product_name,brand,category,initial_price,final_price,rating,brand_encoded,category_encoded
"30x40cm Adult Diamond Painting Kits, DIY 5D Full Round Diamond Art Painting Kits, Diamond Painting Flower Gifts Home Wall Decor",SHEIN,DIY Diamond Painting & Accessories,3.7,3.6,0,25,95
"Unbeatablesale 14 X 20 In. Rondeau Placemats,; Paprika - Set Of 4",Unbeatablesale,Pet Placemats,29.39,29.39,0,30,330
"30pcs Mixed Transparent Tulip & Sunflower 5-Petal Flower Resin Accessories DIY Hair Clips, Phone Cases, Shoe Decorations (ABS Resin)",SHEIN,Fittings DIY & Tools,2.0,1.9,0,25,149
Jack Daniels Black And Grey Hat,SHEIN,Men Baseball Cap,48.99,48.99,0,25,258
"Unbeatablesale Jacks 1289-WH Cotton Lead Rope With Bull Snap, White",Unbeatablesale,Standard Leashes,21.72,21.72,0,30,390
"1 Set Of Halloween Spider, Horror Scene Decoration Spider Silk, Indoor And Outdoor Horror Halloween Decoration Spider Silk, 20g Spider Silk Plus 2 Spiders",SHEIN,Halloween Party Supplies,2.7,2.6,0,25,177
Unbeatablesale KD 16082 Screw Hole Cover In Black,Unbeatablesale,Hanging Hardware,21.63,21.63,0,30,183
"20pcs Plastic Straws, Reusable Flexible Flower Shaped Straws For Party Drinks & Cocktails",SHEIN,Disposable Kitchenware,4.2,4.1,0,25,117
"New Retro Metal Frame Fashion Trendy Versatile Women & Men Fashion Glasses, Premium Daily, Street, Party, Outdoor Use Halloween",SHEIN,Women Fashion Glasses,4.3,3.66,0,25,469
1 Set Retro Unique Geometric Metal Square Exaggerated Open Bangle And Ring Jewelry Set For Women,SHEIN,Women Jewelry Sets,2.5,0.75,0,25,476
"36 Pieces, 3D Black PVC Bat Halloween Decoration - Scary Decorative Prop For Bar Room, Wall Sticker - Great For Halloween Parties And Supplies, Weird Stuff",SHEIN,Wall Decor & Stickers,2.0,2.0,0,25,434
"1pc Trendy New Motorcycle Style Men's Watch, Alloy Steel Band, Men's Quartz Watch, Luminous Dial",SHEIN,Men Quartz Watches,11.0,10.3,0,25,267
INSULATED CONNECTOR KIT CONNECTOR Electrical Crimp Connectors,SHEIN,Wire Junction Boxes,25.7,25.7,0,25,448
"Plaid Pattern Shoulder Tote Bag for Women, Top Handle Hobo Handbag Purse with Pendant, Large Capacity Purse Satchel Fashionable School Gift Crossbody Purse Travel Bags, Satchel Bag Vintage Laptop Handbags For Commuting & Going Out",SHEIN,Women Tote Bags,9.3,8.7,0,25,494
22 Inches Synthetic Hair Band Long Curly Body Wave Ponytail Clip With  Hair Extension Wrapping Ponytail Extension Hair  For Women Daily Used (Black+Blue)Heat Resistant Fiber Synthetic Ponytail,SHEIN,Synthetic Extensions,4.4,3.8,0,25,403
2024 New - Battle People Toy - Children's Toy - Interactive Toy - Battle Game Toy - Knockdown People - Parent-Child Battle Mini Game Console - Birthday Gift - Easter Gift - Halloween Gift - Christmas Gift - Perfect Gift - Gift - Children's Toy,SHEIN,Kids Interactive Games,2.2,2.2,0,25,217
"20pcs Halloween Ghost & Pumpkin Lollipop Decorative Cards, Party Supplies",SHEIN,Other Party Favors,1.8,1.67,0,25,296
"32.6"" Tall Barrel Fountain With Adjustable Pump - 4-Tier Cascading Water Fountain Outdoor With LED Light&Charming Water Feature, Rustic Style Garden Waterfall Fountain For Indoor, Outdoor",SHEIN,Floor-Standing Fountains,187.3,135.5,0,25,153
20PCS Miniature Halloween Figurines Skulls Heads Terrifying Resin Micro Skeleton Ornament Halloween Prank Props Trick Toy Favors Crafts For DIY Halloween Crafts Bar Home Party Bonsai Landscape Decor,SHEIN,Festival Decor,4.1,4.0,0,25,141
Unbeatablesale Tape Logic PL438 4 .5 X 5 .5 In. 2 Mil Poly Red Documents Enclosed Envelopes,Unbeatablesale,Paper Envelopes,39.85,39.85,0,30,312
"1pc Transparent Round Stamp Tool, DIY Handmade Circular Stamp Embossing Tool",SHEIN,Embossing Tools,13.9,13.4,0,25,133
"20OZ Cute Halloween Skull Printing Insulated Cup Double Walled Vacuum Insulated Stainless Steel Water Bottle Premium Summer Drink Ware Portable Handy Flask Travel Mug Iced Coffee Cup For Outdoor Camping, Hiking, Driving, Travel, Perfect Gift Idea",SHEIN,Insulated Water Bottles for Outdoor,16.3,10.2,0,25,193
"1PC Jellyfish Thickened Baby Water Pad For Crawling And Training ,Comfortable Cushion For ,Promotes Sensory Development And Coordination Halloween Decoration",SHEIN,Kids Interactive Games,5.2,5.2,0,25,217
"Unbeatablesale 15 In. Wood Cutlery Tray Insert For Drawer - Maple, Birch",Unbeatablesale,Utility Shelves,65.92,65.92,0,30,429
"10pcs Mixed Color Bells, Pet Cat And Dog Bells, Houses, Garden Decorations",SHEIN,Bells,1.6,1.5,0,25,27
"1 Set Of 10 Arabic Children's Bedtime Story Picture Books, Improving Children's Cognitive Abilities, Suitable For Office, School, Drawing, Students, Markers, Stationery, Boys, Girls, And School Supplies Halloween Decoration",SHEIN,"Kids Diaries, Journals, & Notebooks",7.4,5.92,0,25,211
Gucci PFM GUC BLOOM EDT 100ML,Gucci,Perfume,162.0,130.6,0,10,323
"1PC Simulated Plant/Knitted Sunflower, Suitable For Gift Giving, Placed In Study, Bedroom, Etc",SHEIN,Artificial Plants,3.2,2.02,0,25,6
"Unbeatablesale Tape Logic T902P036PK 2 In. X 110 Yards - Packing List Enclosed Pre-Printed Carton Sealing Tape, Red & White - Pack Of 6",Unbeatablesale,Skateboard Grip Tape,107.13,107.13,0,30,377
Unbeatablesale Hydrocollator 00-1014 5 X 12 In. Half Size Moist Heat Pack,Unbeatablesale,Hot & Cold Therapies,25.37,25.37,0,30,191
"1pc Triangle Pull Flag, Colorful Paper Hanging Banner Decoration For Party",SHEIN,Banners & Pennants,1.8,1.37,0,25,17
"1 Set Of 6 Spanish Children's Recognition Flashcards To Improve Kids' Cognitive Ability And Visual Color Discrimination, For Use In Office, School, Drawing, Students, Markers, Stationery, Boys, Girls, And As School Supplies Halloween Decoration",SHEIN,"Kids Diaries, Journals, & Notebooks",9.0,9.0,0,25,211
"Unbeatablesale Julia Teaspoon, Pack Of 12",Unbeatablesale,Fondue Forks And Utensils,39.11,39.11,0,30,155
Unbeatablesale Johnson Wax 00388 20 Count 1 Quart Freezer Bags,Unbeatablesale,Food Storage & Transport Tools,20.67,20.67,0,30,158
"1PC-Natural Jute Rope 164 Feet Long Jute Rope For Crafts Gift Packaging Gardening Wedding Decorations, Christmas Decorations, Halloween Decorations",SHEIN,Shredded Tissue Paper,2.0,1.52,0,25,375
"Tabletop Mini Christmas Tree, 17.81"" Artificial Christmas Tree Miniature Pine Christmas Tree With Linen Base Perfect For Christmas Decorations, Home, Kitchen, Dining Table",SHEIN,Decorative Crafts,16.3,15.7,0,25,100
"1pc Transparent Multi-Compartment Makeup Organizer Box, Desktop Multi-Function Storage Box For Cosmetic Brushes, Lipstick, Student Pen Holder",SHEIN,Makeup Organizers,5.2,2.6,0,25,252
TPU Cherry Blossom Pink Couples Car Anti-Drop Key Cover Case For Chevrolet Malibu XI/Cavalier/Cruze/Trax/Sail Dedicated,SHEIN,Car Key Case,2.3,2.07,0,25,44
"30pcs New Artificial Christmas Pine Tree Branches, Berries, Christmas Fake Tree Branches, Red Berry Stems, Pine Needle Tree Wreath Xmas Winter Wonderland Festival Party Home Decoration",SHEIN,Festival Decor,15.0,14.5,0,25,141
"DAZY Simple Solid Color Headband, Suitable For Daily Wear",DAZY,Headbands,1.8,1.7,0,5,185
"Sun Protective Anti UV Summer Outdoor Ice Silk Sun Protection Neck Gaiter, Motorcycle Balaclava Face Mask For Cycling Ski Mask",SHEIN,Cycling Mask & Scarf,2.0,1.2,0,25,94
"30pcs Clips,Slide Clips,METAL Slide Clips Paper Office Supplies School Supplies For School",SHEIN,Clips,5.0,5.0,0,25,65
"150PCS Pink Stickers Aesthetic Vinyl Stickers Decals Scrapbook, Journaling, Laptop, Bumper, Skateboard, Water Bottles, Computer, Phone",SHEIN,Assorted Stickers,3.5,3.5,0,25,9
1 Set B O Y Or G I R L Gender Reveal Voting Game Poster Board Genders Stickers B A B Y Gender Reveal Party Decoration B A B Y Shower Supplies,SHEIN,Party Backdrops,3.5,3.3,0,25,314
Unbeatablesale 14 X 2 X 20 In. Perimeter Tee For 8 Traditional Coffered Ceiling System,Unbeatablesale,Wall Decoration,44.06,44.06,0,30,435
"32 Pieces Of Random Colors Children's Kitchen Toy Set, Kettle, Cooking Pot, Wok, Pressure Cooker, Knife Shovel Plate, Fruit Food, Suitable For Boys And Girls Educational Toys!",SHEIN,Kids Kitchen Playsets,24.5,24.5,0,25,218
"20pcs Durable White Garden Labels: Reusable, Outdoor And Greenhouse Plant Markers",SHEIN,Food Packaging Tape & Stickers & Labels,2.7,2.6,0,25,157
"1 Set Double-Sided Magnetic Dart Board Kit, Home Use Magnetic Dart Board Game With 4 Random Colored Darts,Adult Party Games Suitable For Halloween/Christmas/Thanksgiving",SHEIN,Dartboards,10.9,9.6,0,25,97
"1pc Transparent Razor Storage Box, Dustproof Razor Holder, Portable Travel Accessory Case",SHEIN,Commercial Personal Suppliers Storages,1.7,1.36,0,25,73
1PC Moth Tarot Tapestry Retro Sun Rainbow Vintage Boho Wall Hanging Astrology Divination Star Room Bedroom Home Decor Cloth Gift,SHEIN,Decorative Tapestry,3.2,2.72,0,25,108
1PC LED Solar Light Outdoor Dandelion Lights Garden Decoration String Lamp Courtyard IP65 Waterproof Solar Light Fairy Lamps,SHEIN,Lawn Lamps,57.5,48.88,0,25,242
"Unbeatablesale 36 X 72 In. Cordless Solstice Vinyl Roll-Up Blind, Woodtone",Unbeatablesale,Window Valance,34.69,34.69,0,30,447
"Interlocked Heart Stainless Steel Earrings, For Daily Wear",SHEIN,Women Dangle Earrings,1.4,1.12,0,25,467
"1 Roll 60 Feet Decorative Straight Rolled Trim For Classroom & Office - Wooden Pattern Bulletin Border Trim, Colorful Craft Paper Decor For School Displays",SHEIN,Assorted Stickers,5.4,5.4,0,25,9
Street Style Plain Color Casual Shoulder Bag New Fashion Simple Handbag Crossbody Square Bag,SHEIN,Women Top Handle Bags,9.6,9.0,0,25,493
Unbeatablesale Irion Pro Half Pipe Caulking Gun For Cartridges Up To 10.5 Oz,Unbeatablesale,Caulking Guns,58.39,58.39,0,30,48
"140cm*100cm Warm Flannel Wearable Throw Blanket, Slouchy Office TV Blanket",SHEIN,Wearable Blankets,16.8,16.8,0,25,442
Anewsta Women's Casual Solid Color Hooded Short Sleeve Padded Coat For Winter,Anewsta,Women Winter Coats,76.79,65.27,0,0,496
Unbeatablesale 34 X 54 In. Piccadilly Floral Indoor & Outdoor Area Rug,Unbeatablesale,Decorative Rugs,72.21,72.21,0,30,107
Junsun Android 13 Car Radio Stereo For Hundai Santa Fe 2 2006 2007 2008 2009 2010 2011 2012 Car Auto Radio Built-In Wireless Carplay For Apple & Android Auto 9 Inch Automotive Multimedia Touch Screen 2GB RAM 32GB ROM Car Intelligent Systems Head Unit With GPS Navigation DSP Bluetooth,SHEIN,Car Intelligence System,148.6,105.5,0,25,43
"Unbeatablesale Intertape Polymer Group 761-F5039-05 72 X 100 6100 Tape, Tan",Unbeatablesale,Masking Tape,66.57,66.57,0,30,255
Unbeatablesale Swan Votive Holder Pairs,Unbeatablesale,Decorative Bowls & Plates,28.23,28.23,0,30,99
1-Piece Synthetic Heat Resistant Straight Hair Middle Part No Bangs Wig Black 26 Inch Fully Machine Woven Daily Natural Realistic Wig,SHEIN,Synthetic Woven Wigs,16.0,14.0,0,25,407
"1pc Ultra Thin Transparent Hard PC Case Compatible With Samsung Galaxy Z Flip 5 5G, Scratch Resistant",SHEIN,Basic Phone Cases,2.0,2.0,0,25,20
"1PC Punk Women's Belt Garter Belt, Adjustable Elastic Leather Women's Lingerie Accessories, Punk Party Leg Loop Belt",SHEIN,Women Harness Belts,5.8,4.13,0,25,472
"1 Set Eyeglasses Nosepads, Silicone Anti-Slip Glasses Temples Tip Covers, Adjustable Eyewear Hooks & Extenders For Adult & Sunglass",SHEIN,Eyeglass Care,2.2,2.2,0,25,136
Unbeatablesale 1.25 X 3.75 In. Clear Label Holder - Pack Of 250,Unbeatablesale,Labeling Supplies,39.1,39.1,0,30,239
Unbeatablesale Kaba L1-1004 Lockwood Lock Key Blank- Pack Of 10,Unbeatablesale,Safe Accessories,34.37,34.37,0,30,359
"Bandai Namco Tamashii Nations - Mobile Suit Gundam: The 08th MS Team - RX-79(G)EZ-8 GUNDAM EZ-8 Version A.N.I.M.E. - Bandai Spirits ROBOT SPIRITS  [COLLECTABLES] Figure, Collectible",Bandai Namco,"Statue, Maquette & Bust Action Figures",66.75,66.75,0,3,393
"Plaid Pattern Shoulder Tote Bag With Bag Charm Handbags for Women, Shoulder Tote Bag Purse Top Handle Hobo Handbag, Large Capacity Purse Satchel Fashionable Tote Bag School Gift, Retro Crossbody Purse Hiking Back pack Travel Bags",SHEIN,Women Tote Bags,10.7,8.03,0,25,494
"1 Set Wooden Sudoku Game With 9 Grids - Includes Wooden Digits, Game Board And Storage Drawer, Comes With Puzzle Book - Challenging Brain Teaser For Adults And Children",SHEIN,Kids Sudoku Puzzles,13.7,13.7,0,25,227
"2024 New 5G Dual-Band HD Home Projector, Android & IOS Smartphone Mirroring, Support Wall Projection, Mini Home Cinema, Game-Capable, Distance Learning, Christmas & Valentine's Day Gift",SHEIN,Projectors,88.0,88.0,0,25,349
"Unbeatablesale Tarifold Magneto Repositionable Adhesive Display Frames,; Silver - Letter Size",Unbeatablesale,Office Adhesive Tape,24.44,24.44,0,30,284
1pc Turquoise Silver-Tone Metal U-Shape Vintage Western Style Hair Clip For Women,SHEIN,Women Hair Jewelry,2.7,2.3,0,25,471
Unbeatablesale PAC Racing Springs PACPAC-R363 Valve Spring Retainers - C-M Steel - 7 Deg,Unbeatablesale,Car Replacement Parts,104.35,104.35,0,30,45
Unbeatablesale K-S9840 0.5 X 6 Mm Brass Strips,Unbeatablesale,Hanging Hardware,19.35,19.35,0,30,183
"Unbeatablesale TZ Case TC-06 LP Basic Beauty Case, Leopard",Unbeatablesale,Makeup Bags,71.97,71.97,0,30,251
"Unbeatablesale 1 Qt. Screw-On Poultry Waterer Base,; Lime Green",Unbeatablesale,Bird Feeders & Animal Husbandry,9.49,9.49,0,30,29
"Unbeatablesale Tarifold P20061 9 X 12 In. Water-Resistant Repositionable Pocket, Clear - Pack Of 10",Unbeatablesale,Labeling Supplies,16.28,16.28,0,30,239
Kariban Womens/Ladies Pique Polo Shirt (Black),SHEIN,Women's Sports Polos,35.0,17.99,0,25,498
"Unbeatablesale 215R Alternator Bracket For Small Block Chevy Long Water Pump, Right Hand Mid-Mount",Unbeatablesale,Car Replacement Parts,73.16,73.16,0,30,45
Unbeatablesale International Concepts K05-30RT-6B 30 In. Round Top Pedestal Table With Counter Height White & Heather Gray,Unbeatablesale,Dining Tables,335.59,335.59,0,30,113
1PC Outdoor Multi-Use Knife BBQ Patio Cutting Steak Special Knife Cutting Barbecue Knife Cutting Chicken Wing Knife BBQ Special Knife Outdoor Cooking Special Knife,SHEIN,Kitchen Knives,5.8,4.93,0,25,235
"International Harvester Logo Sticker - 5 Inch Vinyl Decal - Classic Red And Black Design For Trucks, Tractors, Laptops, Water Bottles, And More - Durable And Waterproof",SHEIN,Stickers,1.5,1.4,0,25,394
1PC Negative Thoughts Sticker | Mental Health Awareness Decal | Normalize Therapy & Self Love | Let That Stuff Go | Perfect For Anxiety & PTSD Support | Trendy Design For Trauma Dumping & Intrusive Thoughts,SHEIN,Stickers,1.3,1.16,0,25,394
1PC Reader - Golf  Ball Marker With High Precision  Black Green Reading Aid Golf Accessories For Men Women,SHEIN,Copyholders & Book Stands,6.9,6.9,0,25,77
1PC Natural Polished Crystal Witch Hat Carving Random Color Healing Reiki Stone Amethyst Opal Wizard Hat Handcrafts Halloween Gifts,SHEIN,Healing Crystals,4.2,3.6,0,25,186
"Unbeatablesale Tac Shield TCSH T4510CY Universal Slim Line Admin Molle Pouch, Coyote",Unbeatablesale,Tactical Vest & Harness,55.69,55.69,0,30,411
"1pc Trendy Copper-Tone Multi-Color Cubic Zirconia Necklace & Earring Set, Suitable For Daily Wear",SHEIN,Women Pendant Necklaces,2.6,2.6,0,25,480
"30pcs Gold Color Hair Scrunchies Set For Women, Y2K Punk Bohemian Accessories Hair Ties Decor, Party Gift",SHEIN,Women Braid Rings,1.5,1.5,0,25,459
"20pcs Mini Beverage Bottle Figurines, Home Office Desk Decor, Miniature Accessories, Room Decoration, Home Decoration",SHEIN,Kids Dress Up Sets,3.3,3.3,0,25,213
1-Piece Synthetic Heat Resistant Straight Hair With Bangs Princess Cut Wine Gradient Ramp 28 Inch Fully Machine Woven Daily Natural Realistic Wig,SHEIN,Synthetic Woven Wigs,16.0,13.37,0,25,407
"20pcs Solid Color Bow Satin Hair Clips, Lace Elegant Hair Clips, Ballet Style Hair Clips, Suitable For Hairstyle, Cute Hair Accessories",SHEIN,Hair Clips,1.9,1.8,0,25,175
"Sunflower Stem (Set Of 6) 23.5""H Polyester/Plastic",SHEIN,Artificial Flowers,76.99,57.48,0,25,4
20PCS Women's 3 Color Box Y2k Dopamine Color Pentagon Star Small Hairpin Bb Clip,SHEIN,Hair Clips,2.3,2.2,0,25,175
36 LEDS UV Light Drier Nail Gel Polished Portable Ultraviolet LED Nail Light With 4 Timers Set LCD Display Automatic Sensor Professional Nail Tool,SHEIN,Electronic Nail Art Equipment,15.0,15.0,0,25,132
"1PC Personalized DIY Custom Name Necklace Stainless Steel Jewelry Goth Ghost Brand  Women's Pendant Gold Accessories Halloween Gift, Customizable Name Simple Daily Style, Keychain, Gift Box And Other Gifts, Valentine's Day Gift, Birthday Gift, Mother's Day Gift, Daily Gift",SHEIN,Customized Fashion Engraved Necklaces,6.3,6.3,0,25,90
Synthetic Heat Resistant Front Lace Wig With Baby Hair 13*4 Extra Long Black Straight Hair 34 Inches Daily Use Women's Wigs Natural And Beautiful High Quality Synthetic Soft Beginner Friendly Wigs,SHEIN,Synthetic Lace Wigs,34.2,29.8,0,25,405
Unbeatablesale Irwin Vise-Grip 586-323S 3 Pc Original Locking Pliers Set C,Unbeatablesale,Pliers,61.06,61.06,0,30,336
"10pcs Vibrant Black Latex Birthday Balloons With Printed Letters - PerfectParty Decorations For Celebrating Special Moments - Durable, Inflatable,And Reusable",SHEIN,Decorative Balloons,1.8,1.53,0,25,98
"1 Set Of 10 Non-Repetitive Large EVA Sticker Sheets, Made Of  And Odorless Materials, Suitable For Children's Handicraft DIY Sticker Artworks That Can Develop Their Hands-On And Thinking Skills, Appropriate For Children Aged 3 And Above, Great Preschool And Children's Day Gift Toy For Kids",SHEIN,Kids Stickers & Collage,5.5,5.5,0,25,226
Unbeatablesale PIX North America A19 21 In. FHP Rubber V-Belt Black,Unbeatablesale,Tool Cases,16.71,16.71,0,30,422
Unbeatablesale Integra Bullet Tip Dry-Erase Whiteboard Markers,Unbeatablesale,Markers,14.42,14.42,0,30,254
"Unbeatablesale 31 X 64 In. Cordless GII Morningstar 1 In. Mini Blind, Black",Unbeatablesale,Window Valance,29.69,29.69,0,30,447
"10pcs Muted Color Mini Travel Makeup Brush Set, Soft Bristle Eye Shadow Brushes",SHEIN,Brushes Sets,4.0,3.5,0,25,36
"Unbeatablesale Jacks 397-GN Single Thick Lead Shank With 20 In. Brass Plated Chain, Green",Unbeatablesale,Standard Leashes,20.45,20.45,0,30,390
"32pcs Alloy Round Shape Earring Hoops For Jewelry Making, Diy Craft Art Accessories, Golden, Open Hoop, 20mm/30mm/40mm/50mm",SHEIN,Jewelry Making Earring Findings,2.8,2.8,0,25,202
"21Pcs Interchangeable Welcome Sign For Front Door With 4 Seasonal Wreaths And 14 Changeable Icons For Door Decor Rustic Round Wood Sign,Outdoor Seasonal Welcome Home Decorations Farmhouse Front Porch Decor",SHEIN,Door Decorations,25.4,23.9,0,25,121
SHEIN VCAY 1 Solid Color Nylon Fashionable Versatile Simple Large Capacity Tote Bag,SHEIN,Women Tote Bags,11.6,10.8,0,25,494
Nike Jordan 13 Retro Low Bred GS 310811 027,Nike,Women Casual Athletic Shoes,475.93,340.24,0,20,462
Unbeatablesale Jacks 10477 Gel Curb Chain Guard,Unbeatablesale,Horse Grooming & Bathing Supplies,22.01,22.01,0,30,190
1 Strand Approx. 160pcs 3mm Natural Black Quartz Faceted Beads For DIY Jewelry Making,SHEIN,Beads,1.8,1.8,0,25,25
14PCS Simulated Sea Life Toy Model Realistic Marine Ocean Animals Whale Shark Dolphin Turtle Octopus Toys For Kids Birthday Gifts Box,SHEIN,Kids Sea Animal Figure Toys,9.3,9.3,0,25,222
"Unbeatablesale PIX North America B55 58 In. FHP Rubber V-Belt, Black",Unbeatablesale,Tool Cases,18.11,18.11,0,30,422
Jurassic Park Camo Logo Snapback Cap (Multicolored),SHEIN,Men Baseball Cap,56.0,20.99,0,25,258
"1pc Transparent Waterproof Cosmetic Bag, Luggage Organizer Pouch For Travel, Unisex",SHEIN,Makeup Bags,2.8,2.8,0,25,251
Unbeatablesale Sunpentown 26 Lbs Capacity Rice Dispenser - SC-12,Unbeatablesale,Pressure Cookers,63.52,63.52,0,30,347
30cm Doll Girl Toy Doll New Silk Suit Dress 8 Piece Set = 1 Piece Of Dalian Dress + 1 Necklace + 1 Crown + 2 Earrings + 1 Bag + 2 Pairs Of Shoes (Doll Not Included) Holiday Gift Toy,SHEIN,Kids Clothing Accessory Sets,3.2,3.2,0,25,209
"Unbeatablesale Jacks 2128F-WH-L Ribbed Bell Boots With Fleece - White, Large",Unbeatablesale,Pet Shoes & Boots,24.08,24.08,0,30,331
Unbeatablesale Intensity N3220410MED Men Football Practice Jersey Navy - Medium,Unbeatablesale,Men Football Uniforms,30.73,30.73,0,30,264
SHEIN BAE Women's Dating & Valentine's Day Party Shoulder Bag,SHEIN,Women Shoulder Bags,9.5,5.7,0,25,487
"1 Set Low-Profile Luxury Black Gold Signature Pen, Metal Ball Pen, High-End Business & Office Calligraphy Signing Pen, Unisex",SHEIN,Gel Pens,3.5,3.5,0,25,165
"36pcs Colorful Laser Fireworks Star Element Design Translucent PET Waterproof Stickers, Colorful Dream Series Art Supplies, Suitable For DIY Diary Scrapbook Album Mobile Phone Computer Water Cup Decoration (6 Pattern Designs)",SHEIN,Assorted Stickers,4.9,4.9,0,25,9
"30pcs, Merry Christmas Wooden Letter Ornament - Perfect For Home Decor And Holiday Celebrations",SHEIN,Holiday Decoration Supplies,4.6,4.4,0,25,187
"20pcs Pink Floral Carriage Shape Paper Napkins, ""Just Married"" Printed, Wedding Restaurant Hotel Party Decorative Napkins, Party Supplies",SHEIN,Disposable Napkins,2.3,2.2,0,25,118
"New Fashion Solid Color Shoulder Bag For Streetwear, Casual Handbag, Simple Crossbody Bag, Small Square Bag",SHEIN,Women Top Handle Bags,7.3,6.8,0,25,493
Talia Hyaluronic Acid Hydrate & Firm Mask With Niacinamide (B3),Talia,Facial Masks,59.99,46.81,0,27,138
10pcs Rose Gold Satin Chair Sashes Hotel Party Banquet Chair Tie Knots Birthday Event Wedding Decoration Silk Chair Ribbon Bows,SHEIN,Sashes,11.7,10.05,0,25,362
Unbeatablesale Super Power Supply 010-SPS-19918 DC Car Adapter Charger Cord- 9 Volt 1.5 Amp,Unbeatablesale,Charger Cable Adapters,17.33,17.33,0,30,56
"1 Set Of 25pcs Black, Blue & Red Ink Erasable Pen Refills 0.5mm, Magical Erasable Gel Pen With 3pcs Pens, 20pcs Refills & 2pcs Erasers For Office & School Supplies",SHEIN,Gel Pens,2.7,2.7,0,25,165
Unbeatablesale Sunex SUN5303 1 Inch Female X 3/4 Inch Male Impact Socket - Adapter,Unbeatablesale,Sockets,42.31,42.31,0,30,381
"21pcs Reusable Baking Decorating Tips Set - 12pcs Piping Nozzles, 2pcs Small Couplers, 2pcs Blue Piping Bags, 3pcs Blue Icing Spatula, 2pcs Blue Rubber Bands",SHEIN,Piping Bags & Tips,2.9,2.23,0,25,333
"1pc Trendy Gold Stainless Steel Green Cubic Zirconia Pendant Necklace, Everyday Jewelry Gift For Women",SHEIN,Women Pendant Necklaces,2.4,2.4,0,25,480
"Jepeak Jepeak Decorative Linen Throw Pillow Covers Cushion Cases, Pack Of 2 Rustic Woven Textured Pillow Covers For Sofa Bed Couch, 24x24 Inch",Jepeak,Cushion Cover,23.8,17.1,0,12,87
"1pc/3pcs 10mm Cute Flower Silicone Straw Caps, Reusable Straw Dust Plugs Fit For 30oz & 40oz Tumblers, Valentine's Day Gift School Supplies,Back To School",SHEIN,Straw,2.2,2.1,0,25,399
"1set Of 25pcs Black, Blue & Red Erasable Gel Pen Refills, 0.5mm Tip, Reusable Pen With Magic Eraser, School & Office Supplies (3pcs Pen + 20pcs Refills + 2pcs Eraser)",SHEIN,Gel Pens,2.6,2.08,0,25,165
Joico K-Pak Shampoo To Repair Damage For Unisex - 33.8 Oz Shampoo,Joico,Shampoos & Conditioners,42.5,31.75,0,13,371
"Unbeatablesale TCpop8x108-Pk10-WhiteP11 Polyester Poplin Chair Bows, White - 8 X 108 In. - Pack Of 10",Unbeatablesale,Other Party Accessories,40.57,40.57,0,30,294
"Unbeatablesale 22 In. Full Extra G-Slide Zinc, 100 Lbs",Unbeatablesale,Drawer Organizer,31.54,31.54,0,30,126
"1 Plaid Black And White Fashion Crochet Breathable Portable Portable Mobile Phone Umbrella Cosmetics Book Open Ladies Handbag Vest Bag, Daily, Holiday, Commute, Shopping, Photography, Travel, Camping, Hiking, Back To School, Travel, Holiday, School Girls Girls Ladies Suitable For Four Seasons Bag Mother's Gift",SHEIN,Women Tote Bags,13.2,12.3,0,25,494
"1 Set Of 5pcs Felt DIY Crafts Kit,  Non-Woven Fabric Decoration Hanging Ornament Gift Making Materials",SHEIN,Kids Sewing,7.6,4.94,0,25,223
Unbeatablesale K-Source KSI81850 Snap & Zap Towing Mirror Extension Set With Storage Bag,Unbeatablesale,Car Replacement Parts,81.64,81.64,0,30,45
"1pc Unique Crystal Studded Seahorse Design Brooch, Women's Casual Anti-Exposure Decorative Lapel Pin",SHEIN,"Women Brooch, Lapel Pin & Scarf Ring",1.7,1.7,0,25,460
"Women's Classic Color Contrast Spliced Tote Bag, Large Capacity Durable Lightweight Storage Shoulder Bags, Casual Versatile Commuting Work Sling Bag, Shopping Groceries Handbag For Daily Use, Fashion Valentine's Day Mother's Day Gifts",SHEIN,Women Tote Bags,9.6,9.0,0,25,494
"9pcs Party Queen Lace Masks, Shapeless Masquerade Mask, Sexy Venetian Carnival Eye Mask",SHEIN,Costume Eyewear,6.0,3.9,0,25,79
"20pcs Mixed Color Acrylic Geometric Pattern Three-Dimensional Color Checkerboard Square Beads - DIY Handmade Jewelry Making Supplies For Fashion Bracelet And Necklace Decoration - Synthetic Material, No Mosaic, No Plating, Straight Hole Design",SHEIN,Beads,4.1,2.46,0,25,25
"1PC Mini Stapler With Staples Portable Stapler Portable Mini Cute Desktop Stapler Set With Staples Student Stationery Office Supplies, Manual Stapler",SHEIN,Staples,2.6,2.08,0,25,391
"Synthetic Hair Extensions 24"" Invisible Wire No Clip In Hair Extensions Secret Fish Line Straight Curly Wig Accessorie Dark Brown High-Temperature Resistant Authentic And Natural",SHEIN,Synthetic Extensions,3.3,2.34,0,25,403
"30pcs/Box 14mm Color Spray Painted Small Bells In 10 Grid Storage Boxes Suitable For Making Key Chain Pendants Bells DIY Christmas Jewelry Accessories, Phone Chains, Clothing Accessories",SHEIN,Pendants,3.8,3.8,0,25,321
"Unbeatablesale 1.25-2 In. Original Cordless Binaural Hearing Aids,; Brown",Unbeatablesale,Bandage,23.65,23.65,0,30,16
"1 Roll, 10 Yards Christmas Mesh Tulle For DIY Wreath, Christmas Tree, Party Decor, Gift Wrap, Holiday Decorations, Flower Bouquet, Outdoor Garden Decoration",SHEIN,Festival Decor,4.4,3.74,0,25,141
32 PCS Hot Pink Balls Cake Decoration B Aby Shower Cake Decoration Pink Leaves Palm Leaves Cake Decoration Boho Cake Decoration For Wedding Birthday Bachelorette Party,SHEIN,Cake Toppers,6.6,6.3,0,25,38
Unbeatablesale Jasco Products 26427 18 In. Plug Led Lgt Fixture,Unbeatablesale,Lighting Fixture Chains,48.18,48.18,0,30,244
