product_name,brand,category,initial_price,final_price,rating,brand_encoded,category_encoded
Unbeatablesale Kellogg Plastics 59305 0.75 In. Holiday  Christmas Indoor  Outdoor LED- Multi Color - Frosted Ball,Unbeatablesale,Christmas Party Supplies,23.82,23.82,0,30,60
"1pc Sofa Cover Only, Price For Cover Only, Excluding Filler, Overseas Slipcover For Slouchy Bean Bag Tatami Single Living Room Furniture Bean Bag, Leisure Beanbag",SHEIN,Bean Bag Covers,13.2,13.2,0,25,26
"15, Stress Balls: Soft Stress Balls, Small Sensory Balls, Adult Stress Reducers, Classroom Prizes, Candy Bag Fillers, Sensory Toys - Perfect For Halloween, Christmas, Thanksgiving Gifts",SHEIN,Other Kids Early Development & Activity Toys,6.0,6.0,0,25,292
"1 Set 40*50cm Digital Oil Painting Kit ""Green Mountains And Rivers"", DIY Art Painting Supplies For Bedroom & Wall Decor, Simple And Fun Painting Craft To Fulfill Your Artist Dream, Great Gift For Friends",SHEIN,Paint By Number & Accessories,6.1,5.9,0,25,310
"30PCS Christmas Stickers Labels, Christmas Name Gift Labels Xmas Gift Tag Stickers Paper Label Stickers Christmas Self-Adhesive Stickers For Present Party Bags Cards Envelope",SHEIN,Christmas Party Supplies,1.5,1.19,0,25,60
"Unbeatablesale 1.56 In. Subtle Surge Knob, Matte Black",Unbeatablesale,Door Handles & Locks,14.01,14.01,0,30,122
Unbeatablesale Improved Alloy Repair Mask,Unbeatablesale,Decorative Painting Tools,61.65,61.65,0,30,106
"35pcs Gold Color Hair Scrunchies Set, Women Y2K Hippie Boho Hair Clips, Decorative Accessories, Party Gift Hair Braid Rings",SHEIN,Women Braid Rings,1.7,1.7,0,25,459
10pcs Scrapbooking Material Paper Vintage Mysterious Darkness Decor Spider Web DIY Scrapbooking Halloween Decor Planner Stationery Paper,SHEIN,Craft Paper,5.2,5.0,0,25,83
"21pcs/Set Mini Blue Electric Grinder With Rechargeable Pen-Type Polishing Carving Tool For Gemstone, Home Use",SHEIN,Power Tool Sets,26.3,26.3,0,25,345
New Trendy Detachable Hand-Made Shiny Fabric Bow Pearls Shoe Clips Accessories For High Heels & Sandals,SHEIN,Shoe Decorations,3.2,3.0,0,25,372
"10pcs Navy Blue Square Beads, Retro Oil Drop Square Beads For DIY Bracelet Jewelry Making Accessories",SHEIN,Beads,3.3,3.3,0,25,25
"1pc Creative Cute Cat Shape Pencil Case,Cartoon School Supplies,Plush Large Capacity Stationery Storage Bag, High Appearance Value, Niche Stationery Box For Students,Perfect Gift, Back To School School Supplies(Random Style)",SHEIN,Make Up Bags,3.7,3.5,0,25,250
PAGANI DESIGN Top Luxury Japan VH65 Quartz Movement Men Watch Leather Waterproof Sapphire Glass Watch For Men Original 2024 New PD-1689,SHEIN,Men Quartz Watches,72.1,63.68,0,25,267
ROMWE Fairycore Personalized Cold-Tone Gold & Green Sun-Shaped Earrings,ROMWE,Women Dangle Earrings,1.6,1.6,0,22,467
1pc Spiral Open Bangle Bracelet And 1pair Spiral Pendant Earrings Vintage Exaggerated Lady Set,SHEIN,Women Jewelry Sets,3.0,3.0,0,25,476
New Portable Flamingo Pattern Makeup Bag Jewelry Toiletry Holder Case Women's Cosmetics Pouch Water-Proof Travel Organizer Bag,SHEIN,Make Up Bags,2.6,2.5,0,25,250
"1 Set Mini Portable Watercolor Palette With Grid Paint Box Set, Watercolor Paper Pad Watercolor Sketch Book Watercolor Brush Pens With Binder Clips For Painters Artists Students (15 Grids)",SHEIN,Art Sets,11.1,10.26,0,25,3
"1 Set Of Butterfly Pattern Diamond Painting Tool Storage Box, 60 Bottles For Bead Storage, With 5D Diamond Art Accessories And Tools Set",SHEIN,Craft & Sewing Supplies Storage,32.2,23.3,0,25,82
15 Old Black And Black Eye Brushes + 24 Beauty Eggs Puffs Hair Bands Wristbands Complete Set Of Beauty Tools For Face And Eyes,SHEIN,Brushes Sets,7.5,6.25,0,25,36
10 PCS Random Color Silky Satin Hair Bows Hair Clip Beige Black Hair Ribbon Ponytail Holder Accessories Slides Metal Clips Hair Bow For Women Halloween,SHEIN,Hair Clips,5.9,5.6,0,25,175
Unbeatablesale JJAAMM 250838 Wrap-It Black Self-Gripping Storage Cable Ties - Pack Of 20,Unbeatablesale,Anchors,32.14,32.14,0,30,1
"Switch Carrying Case, Hard Shell Travel Carrying Box Case For Switch With 10 Game Cards Holders, Portable Pouch For Switch Console & Accessories -Black",SHEIN,"Nintendo Switch Consoles, Games & Accessories",7.1,7.1,0,25,279
KAPVOE Polarized Cycling Glasses With 4 Interchangeable Lenses TR90 Sports Sunglasses Women Men Running,SHEIN,Cycling Glasses,40.8,22.96,0,25,92
"20pcs Mixed Star Shaped Hair Clips, New Design Hair Accessories For Girls, Bangs Clip, All Season",SHEIN,Hair Clips,2.7,2.21,0,25,175
"New Floral Rabbit Waterproof Apron, Oil&Water Resistant, High-Quality Apron For Home Kitchen Use",SHEIN,Chef Apron & Chef Hat,2.8,2.16,0,25,58
Unbeatablesale Jasco Products 218434 26741 18 In. Wht Led Fixture,Unbeatablesale,Lighting Fixture Chains,63.85,63.85,0,30,244
"1 Set  Style Elegant Gold-Tone Retro Metal Jewelry Accessories Including Necklace, Bracelet, Ring And Earrings, Suitable As Gift For Women On Casual, Party, Christmas And Other Occasions",SHEIN,Women Jewelry Sets,9.4,8.28,0,25,476
30pcs/Pack Fashionable Neon Multi-Color Acrylic Mini Hexagon Starfish Shape DIY Jewelry Making Charms & Pendants,SHEIN,Beads,2.6,2.6,0,25,25
Unbeatablesale Keeney SD102IPS General Purpose Drain For 2 In. Iron Pipe,Unbeatablesale,Showerheads & Accessories,12.3,12.3,0,30,374
Unbeatablesale Jgoodin P11456A-V00-U Womens Elaina Rose Gold Stainless Steel U Initial Necklace,Unbeatablesale,Women Pendant Necklaces,15.04,15.04,0,30,480
Unbeatablesale PCI Brand New Compatible Dell 1230C Bundle B M C Y Toner Ctg 4 Pack For Dell 1230 1230C 1235 1235CN,Unbeatablesale,Toner Cartridge,80.36,80.36,0,30,420
"Sunflower Wreath Seasonal Decor, Door Wall Hanging Wreath, For Indoor Outdoor Home Office Wall, Wedding Festival Thanksgiving Day Decoration",SHEIN,Seasonal Wreaths & Garlands,29.8,25.34,0,25,365
"1 Roll Of Retro Thickened Orange Fruit Flower Wallpaper With A Fresh Style Suitable For Home Decoration, Dining Rooms, Kitchens, Cabinets, Tables And Chairs, Room Backgrounds, Home Renovation, DIY, Waterproof, Stain Resistant, Easy To Clean, Self-Adhesive, Peel And Paste Wallpaper, Wall Stickers, Wall Stickers",SHEIN,Wall Paper,3.1,2.39,0,25,438
"New Season Fashionable Casual Large Capacity Leopard Print Shoulder Tote Bag, Adjustable Strap For Women's Daily & Commute, Trendy Leopard Print Bag",SHEIN,Women Crossbody,6.9,5.18,0,25,466
"1 Pitcher & 4 Cups Heatproof Glass Water Carafe Set, High Borosilicate Glass Large Capacity Modern Simple Water Pitcher Juice Jug Tea Pot Tumbler Set",SHEIN,Water Pots & Kettles,48.4,46.7,0,25,440
"20pcs Luminous Miniature Planter Accessories,Animals,Figurines,Miniature Landscape Decorations DIY Kits, Resin Decorative Outdoor Patio Lawn Yard",SHEIN,Garden Statues & Sculptures,3.3,3.2,0,25,161
"300+ Pieces Of European Vintage Design Materials Pasted Sticker Set , Oil Painting Landscape Material Paper, Elegant Lady Portrait Stickers, Theme Ledger, Decorative Tape, Vintage Furniture Stickers, Vintage Art Fonts, Decorative Ledgers, Notebooks, Cups, Acrylic Panels, Etc",SHEIN,Kids Scrapbooking,6.0,5.88,0,25,221
"32pcs Christmas Vase Filler Decorations For Christmas, Thanksgiving, Tabletop Center Pieces, Birthday Party, New Year Celebration, Floating Candle Decor, Outdoor Garden Yard Decor, Holiday Accessories",SHEIN,Festival Decor,1.9,1.8,0,25,141
"Sweet Style Women's Bubble Pleated Shoulder Bag, Versatile Solid Color Underarm Bag For Daily Use, Small Mobile Coin Purse Evening Handbag, Outdoor Travel Vacation Shopping Bags, Casual Commuting Satchel For Students And White-Collar Workers",SHEIN,Women Shoulder Bags,7.2,6.8,0,25,487
"20pcs Reusable Tile Leveling System Kit - Spacers And Adjustable Pliers For 8-12mm Tiles, Suitable For Wall And Floor, Yellow",SHEIN,Tool Parts,5.5,5.5,0,25,423
"Unbeatablesale TCpop60x120-HotPinkP38 Polyester Poplin Rectangular Tablecloth, Hot Pink - 60 X 120 In.",Unbeatablesale,Other Party Accessories,28.7,28.7,0,30,294
"2pcs Women's Khaki Wavy Bow Beach Sun Hat And Straw Handbag 2-Piece Set, Suitable For Travel",SHEIN,Women Hat set,11.8,8.25,0,25,473
"1pc Unfilled Slipcover For Bean Bag Slouchy Sofa, Cross-Border Exports Only For Slipcover, No Filling Included, Single Seat Living Room Furniture Bean Bag",SHEIN,Bean Bag Covers,13.4,13.4,0,25,26
Unbeatablesale Tape Logic DL1132 2 X 3 In. - Quality Hold Fluorescent Green Labels - Roll Of 500,Unbeatablesale,Garment Labels,26.37,26.37,0,30,164
"34pcs/Set Multi-Color Faceted Glass Beaded Bracelets, Trendy Versatile Jewelry Set For Women",SHEIN,Women Bracelet Sets,11.0,10.72,0,25,458
"Jepeak Jepeak Decorative Throw Pillow Covers Cases Pack Of 2 Chenille Cozy Modern Concise Square Cushion Covers For Sofa Couch Bedroom Home Decor, 20x20 Inch",Jepeak,Cushion Cover,22.6,16.3,0,12,87
"10pcs Reusable Zipper Pill Bags, Pill Storage Organizer And Travel Accessories For Fall Home Decor",SHEIN,Luggage & Travel Bags,3.1,2.9,0,25,247
360 Degree Adjustable Car Air Vent Phone Holder,SHEIN,Automobile Phone Cradles,5.1,5.1,0,25,10
"1 Set Woodworking Measuring Gauge Set, Profile Scribing Ruler Contour With Lock, Adjustable Irregularity Radian Precise Measurement Tool",SHEIN,Protractors,3.8,3.8,0,25,350
"Sweet Style Women's Bubble Pleated Shoulder Bag, Versatile Solid Color Underarm Bag For Daily Use, Small Mobile Coin Purse Evening Handbag, Outdoor Travel Vacation Shopping Bags, Casual Commuting Satchel For Students And White-Collar Workers",SHEIN,Women Shoulder Bags,7.4,5.55,0,25,487
"1pc Silicone Wristband Fits 2.05"" TFT Touchscreen Multifunctional Smart Watch Heart Rate, Oxygen Monitoring, Various Sports Modes, Body Temp, Weather, Bluetooth Call Reminder For Android & IOS",SHEIN,Smart Watches,30.5,15.25,0,25,380
"Unbeatablesale Jacks 172-BU Lead Shank With 20 In. Brass Plated Chain, Burgundy",Unbeatablesale,Standard Leashes,21.79,21.79,0,30,390
New Fashionable Unique Design Summer Crocodile Print Envelope Handbag For Women,SHEIN,Women Clutches,5.0,4.7,0,25,464
"TV Stands For Living Room, Industrial TV Stand For Bedroom Furniture, Farmhouse TV Stand 80 Inch Television Stand , Modern Horizontal Wood And Metal Open Bookshelf",SHEIN,Television Stands & Entertainment Centers,349.9,248.4,0,25,417
2024 Powerful 800W LED Flashlight With Power Display Supports Type-C USB Charging Spotlight 5 Modes Adjustment Retractable Zoom Waterproof Lantern Outdoor Adventure Hiking Emergency Lighting,SHEIN,Flashlights & Torches,27.2,27.2,0,25,150
32 Inch Gradient Brown High Temperature Resistant Large Grip Water Ripple Ponytail Ladies Daily Natural Wig Ponytail,SHEIN,Synthetic Extensions,6.3,5.42,0,25,403
"Unbeatablesale TCpop51R-GrayLgtP41 Polyester Poplin Tablecloth, Light Gray - 51 In. Round",Unbeatablesale,Other Party Accessories,25.49,25.49,0,30,294
"1 Yard Floral Pattern Lace Ribbon Trim For Sewing, Gift Package Wrapping,DIY Crafts And Bridal Wedding Decorations",SHEIN,Garment Decoration Excipients,1.4,1.4,0,25,163
"Summer New Fashion Retro Business Casual Transforming Crescent Moon Women Handbag Chain Mini Messenger Bag Vintage Trendy Simple Shoulder Crossbody Bag, Lightweight Compact Dopamine Style Solid Color Faux Leather Metal Letter Decor Fall Winter Essential Dumpling Lady Bag",SHEIN,Women Top Handle Bags,11.2,10.5,0,25,493
"Summer Fashionable Vintage Style Business Casual Moon Shaped Women's Bag, Simple Retro Chain Shoulder & Crossbody Bag",SHEIN,Women Top Handle Bags,11.0,10.3,0,25,493
"1pc Portable Uv Protection Mini Umbrella For Sunny & Rainy Days, 6-Rib Reinforced Pocket Sun Umbrella With Uv Coating, Beige & Purple",SHEIN,Umbrellas and Rain Hat Umbrellas,7.7,7.5,0,25,428
Sunflower Pattern Linen Cosmetic Pouch For Fall Home Decor,SHEIN,Makeup Bags,2.5,2.4,0,25,251
"1pc Spiral Openwork Bracelet And 1 Pair Spiral Pendant Earrings, Vintage Exaggerated Jewelry Set For Women",SHEIN,Women Jewelry Sets,2.4,2.4,0,25,476
"14pcs Silicone Anti-Slip Eyeglasses Temple Tip Holder Extenders, Suitable For Adult And Children Eyeglasses & Sunglasses",SHEIN,Eyeglass Care,2.5,1.5,0,25,136
"35.5cm*15cm*16cm Handheld Iron Alloy Storage Box, 48pcs Model Cars Set, Halloween & Christmas Gift",SHEIN,Kids Vehicle Playsets,30.6,30.6,0,25,228
"1 Rolls Nude Elastic Self Adhesive Bandage Wrap, Comfort Sports  Bandage, Breathable Flexible Non Woven Cohesive Bandage, For Shock-Absorption, Injury Protection Wrist Elbow Knee Ankle Wrap, Versatile Use",SHEIN,Hand & Elbow & Arm Protectors,3.2,1.6,0,25,178
21-In-1 Assorted Rose Flower Silicone Mold Set For DIY Craft,SHEIN,Candle Molds,3.5,3.3,0,25,40
Flower Pattern Linen Cosmetic Bag,SHEIN,Makeup Bags,2.8,2.7,0,25,251
"1 Roll 1.18in X 32.8ft Aluminum Foil Tape , Oil-Proof Tape For Kitchen Stoves,Caulk Strip,High Temperature Resistant Aluminum Foil Tape,Self Adhesive Waterproof Repair Duct Tape For Bathtub Bathroom Shower Toilet Kitchen Sink Basin Edge And Wall Sealing, Kitchen Bathroom Accessory",SHEIN,Kitchen Sewing Tools and Accessories,2.2,1.87,0,25,236
"Unbeatablesale Hydrangea 60 X 24 In. Tier, Ecru",Unbeatablesale,Window Valance,32.42,32.42,0,30,447
Unbeatablesale Jgoodin N01314RV-V00 Womens Luck Rhodium Stainless Steel Bar Script Necklace,Unbeatablesale,Women Layered Necklaces,15.16,15.16,0,30,477
Unbeatablesale Jacks 1633-NV-74 74 In. Closed Front Nylon Stable Sheet - Navy,Unbeatablesale,Horse Grooming & Bathing Supplies,60.84,60.84,0,30,190
30cm/11.81in Adorable Kangaroo Plush Toy Kangaroo Mother And Child Plushies Soft Perfect Kangaroo Stuffed Animals Dolls Ornament Creative Birthday Gift For Kids Home Girl Room Decor Christmas Thanksgiving,SHEIN,Kids Plush Animals,10.0,9.55,0,25,219
Synthetic Fibre Heat Resistant Wig With Bangs 26 Inch Dark Brown Big Wavy Curly Hair Fully Machine Made For Daily Party Use High Quality For Ladies Natural Looking High Quality Synthetic Soft Wig,SHEIN,Synthetic Woven Wigs,15.5,13.6,0,25,407
"20 Sheets/Pack Matte Waterproof Floral Wrapping Paper, Semi-Transparent Rose Flower Bouquet Gift Packaging Paper, Korean Style",SHEIN,Gift Wrap Paper,6.3,4.85,0,25,168
"ROMWE Goth 1pc Unique Purple Pumpkin Bell,  Hat, Skeleton Hand, Black Star Woven Rope Bag Charm & Keychain, Suitable For Daily Wear And Holiday Gifts",ROMWE,Bag Charms,2.9,2.7,0,22,13
"Super Long Synthetic Hair Wig, 120cm Corn Curly Wig With Bangs, Natural Heat Resistant Princess Lolita Cosplay Wig Party Costume Halloween Wig Hair Replacement Wigs",SHEIN,Synthetic Weave,38.3,25.7,0,25,406
"Unbeatablesale TCRH-WHT-6 Round Table Cover, White - Case Of 18",Unbeatablesale,Other Party Accessories,28.55,28.55,0,30,294
1PC Silicone Penis Sleeve Scrotum Bondage Ring Egg Lock Sperm Ring Penis Ring Ring JJ Lock Stem Ring Couple Tight Lock Ring Penis Exerciser Couple Fun Ring Adult Products,SHEIN,Penis Rings,2.1,1.9,0,25,322
"Jepeak Jepeak Burlap Linen Decorative Throw Pillow Covers Pack Of 2 Farmhouse Modern Cushion Covers Solid Square Pillowcases For Sofa Bed Couch, 18x18 Inch",Jepeak,Cushion Cover,21.4,15.4,0,12,87
"1pc Trendy Frameless Polarized Sunglasses, Unisex UV Protection Driving Fishing Sunglasses",SHEIN,Women Glasses Sets,3.7,3.5,0,25,470
"IDsarah For Galaxy S22 Case With Protector,Shock Absorption Heavy Duty Sturdy Drop Test Slim Cover With Car Mount Kickstand Lightweight Protective Phone Case For Galaxy S22 6.1 Inch,Red,Black,Blue,Rose Gold,Dark Green",SHEIN,Stand Phone Case,10.1,6.9,0,25,387
Unbeatablesale 21152 Exhaust Header Reducer - 3 To 2.5 In.,Unbeatablesale,Car Replacement Parts,55.88,55.88,0,30,45
Unbeatablesale Jacks 1683 Oval Hoof Knife,Unbeatablesale,Pet Health Care Tools,16.88,16.88,0,30,329
"2pcs Ladies Khaki Beach Sun Hat & Crossbody Woven Bag Set With Wavy Bowknot, Perfect For Holiday Travel Boho",SHEIN,Women Hat set,11.2,7.49,0,25,473
Disney 32PCS  Officially Licensed Stitch Balloon Set Green Flowerland Theme Party Decoration Family Party Wedding Anniversary Graduation Cake Decoration Birthday Party Dress Up Gift For Friends,Disney,Events Accessories,8.9,8.5,0,6,135
32K Soft Leather Magnetic Closure Notebook/Planner,SHEIN,Notebooks,7.1,7.1,0,25,281
PAROLL 14x14 Metal Chair Cushions Pads For Tolix Metal Chairs Small Seat Cushions 14 Inch,SHEIN,Chair Cushion,29.99,29.99,0,25,55
1pc UHMWPE Lightweight Bulletproof Ballistic Panel NIJ IIIA Stand Alone Level Body Armor Plates For Vest 10x12in/25x30cm,SHEIN,Other Hunting Equipment,46.9,41.4,0,25,291
"1pc Triangle-Shaped Floor Crevice Brush - Multi-Angle Cleaning Master For Bathroom, Kitchen, Patio - Stiff Bristles, No Dead Corners, Reach Tight Spaces, Great For Toilet, Walls, Window Sills And Outdoor Wall Gaps Cleaning",SHEIN,Brush,4.8,4.8,0,25,35
"20pcs Square Mousse Cake Box, Wooden Bean Milk, Multi-Layered Fruit Yogurt, Transparent Plastic Blister Box, Baking, West Point Packing Box, Reusable",SHEIN,Wrapping & Packaging,9.9,9.5,0,25,501
1/3 Pcs Pure Color Knitted Hair Bands Stretchy Elastic Solid Headbands Sports Hairband For Women Girls Suitable For Yoga Pilates Running Cycling,SHEIN,Hair Bands,1.8,1.37,0,25,173
"KUNJOULAM Modern Floor Lamp, Copper Colour Pole Floor Lamps, Simple Design Tall Lamp With Linen Lampshade, Standing Lamp For Living Room, Bedroom, Office, Home (Without Bulb)",SHEIN,Floor Lamps,92.3,65.5,0,25,151
1PC Sexy Crystal Heart Thong Panties Body Chain Lingerie Jewelry For Women Shiny Festival Outfit Rhinestone Belly Waist Chain Beach,SHEIN,Women Sexy Lingerie Accessories,2.7,2.2,0,25,486
"20pcs/Set Plastic Plant Fixed Clip, Minimalist Solid Color Garden Clip For Outdoor",SHEIN,Plant Cages & Supports,1.4,1.3,0,25,334
"2pcs/Set Khaki Color Wave Design Bowknot Sun Hat & Woven Shoulder Bag For Women, Perfect For Vacation And Traveling Boho",SHEIN,Women Hat set,9.2,7.6,0,25,473
"Unbeatablesale Kate Aspen 31430NA Personalized Water Bottle Labels - He Asked,; She Said Yes",Unbeatablesale,Sports Bottle,24.02,24.02,0,30,385
"KUMI KU7 Smartwatches 1.96"" Amoled 100+Sport Modes NFC IP68 Waterproof Bluetooth Call Health Sleep Monitoring Sos For Man Woman",SHEIN,Smart Watches,51.5,48.57,0,25,380
"Jepeak Jepeak Woven Textured Decorative Throw Pillow Covers, Pack Of 4 Solid Linen Rectangle Farmhouse Cushion Cases For Sofa Bed Couch, 16x24 Inch",Jepeak,Cushion Cover,36.4,26.2,0,12,87
"1 Yard Flower Lace Edge With Ribbon Retro Style Edge Fabric Embroidered Sticker Sewing Craft Wedding, Wedding, Party Clothing Decoration",SHEIN,Garment Decoration Excipients,3.1,3.0,0,25,163
"Unbeatablesale Tape Logic T905P166PK 3 In. X 110 Yards If Seal Is Broken Pre-Printed Carton Sealing Tape, Red & White - Pack Of 6",Unbeatablesale,Skateboard Grip Tape,70.56,70.56,0,30,377
"Disney J300  Passive Noise Cancelling Ear-Clip Style 5.3 Open-Ear Wireless Headphones For Sports & Gaming, LED Display, HiFi Surround Sound, Noise Cancelling Microphone",Disney,Wireless Earbuds,18.8,18.8,0,6,450
1PC Solid Color Plaid Office Chair Seat Cover Water Repellent Gaming Dining Chair Cover Anti-Dirty Computer Chair Slipcover Home,SHEIN,Chair Covers,11.0,11.0,0,25,54
"36pcs Airtight Rectangle Plastic Food Storage Containers Set - Flip Top, Labels Included, Multipurpose, Kitchen And Pantry Organization Canisters For Cereal, Flour, Pasta, And More",SHEIN,Cereal Containers,63.0,45.6,0,25,53
"High School Students University Freshman Multifunctional Sling Bag Shoulder Bag Casual Bag Mini Men Patch Detail Square Bag, Handbag Schoolbag For Travel,College,Outdoors,Sports,Commute Crossbody Bag Sling Bag Shoulder Bag Side Bag Square Bag For Holiday Travel Essentials Summer Gifts For Boyfriend Men Gifts College Bag Fathers Day Gifts DadFor Books Back To School Multi-Functional Dorm Sling Bag For Man Man Bag Cross Body Bag Side Bag School Supplies Fall Messenger Bag Bag For Man Cylinder Bag Old Money Halloween Christmas",SHEIN,Men Crossbody Bags,3.2,2.9,0,25,262
"19pcs Elegant Minimalist Hollow Heart, Sequin, Butterfly Multilayer Anklet Set, Gold-Tone, Perfect For Women Holiday, Party, Date, Daily Wear Gift",SHEIN,Women Anklets,5.1,5.1,0,25,453
"36pcs Acrylic Pacifiers, 2.75 Inch Shower Decorative Pacifiers, Gender Reveal Party Tabletop Confetti, Birthday Party Favors, Pacifier Rattle Game (For Adults)",SHEIN,Other Party Favors,9.9,8.42,0,25,296
"1 Set Pumpkin MoonCake Mold, Mid Autumn Festival DIY HandPress Cookie Stamps Pastry Tool Moon Cake Maker,Fruit Series Cookie Cutters For Baking,Ideal For Autumn, Halloween, And Thanksgiving Halloween Party",SHEIN,Baking & Pastry Utensils,3.6,3.5,0,25,15
"1set Simple And Fashionable Gold-Colored Open Cuff & Choker Set For Women, Adjustable And Elegant, Perfect As A Gift For Her",SHEIN,Women Jewelry Sets,2.3,2.3,0,25,476
"Jepeak Jepeak Decorative Linen Throw Pillow Covers Cushion Cases, Pack Of 4 Rustic Woven Textured Pillow Covers For Sofa Bed Couch, 16x24 Inch",Jepeak,Cushion Cover,36.4,26.2,0,12,87
1 Pc Hair Bows For Women Big Bow Hair Clips For Girls Silky Satin Large Hair Ribbons Oversized Long Tail Hair Bows Hair Barrettes Hair Accessories Gifts Halloween,SHEIN,Hair Clips,1.8,1.7,0,25,175
"31.5"" Spun Bamboo Tall Floor Vase - Sleek Metallic Finish, Elegant Home Decoration, Modern Accent Piece, Living Room Decor, Handcrafted Bamboo Art, Contemporary Interior Design, Unique Tall Vase, Black Large",SHEIN,Vases,204.73,142.18,0,25,430
"15 Magic Jewel Crystal Wish Sets, Including 10 Magic Crystal Wish Jars And 5 Mineral Crystal Meditation Decorated Christmas Gift Boxes",SHEIN,Crystal Soil,23.5,22.7,0,25,85
New Fashion 12 Digit Cartoon Car Pattern Children's Silicone Band Watch,SHEIN,Kids Watches,2.4,2.0,0,25,230
"1PC Silicone Waterproof Cosmetic Bag Makeup Bag For Women Fashion Solid Color Zipper Silicone Toiletry Storage Bag Makeup Accessories Organizer,Toiletry Bag, Cosmetic Bags Lady Makeup Bags ,Zipper Pouch Wallet Toiletry Organizer Pouch Wedding Party Wash Bag Zipper Phone Purse Pencil Pouch Make Up Bags Clutch Bag Bridesmaid Make Up Pouch Toiletries Organizer Bag Cosmetic Case ,Cosmetic Pouch Makeup Tools Makeup Brushes Storage Storage ,Travel Storage Travel Cosmetic Bags,Travel Essential Lightwei",SHEIN,Make Up Bags,5.1,4.8,0,25,250
"1 Set Of 1-10 Numbered Basketball Footwork Training Mats, Dribbliing And Ball-Handling Accessories",SHEIN,Basketball Accessories,18.2,16.0,0,25,21
"Oversized Modular Sectional Sofa Reversible Sectional Couch, U-Shape Sectional Sofa, Oversized Upholstery Sectional Sofa, Chaise Couch With Storage Ottomans For Living Room Loft Apartment Office,3/4/5 Seater Sectional For Living Room, 100'' - Linen",SHEIN,Sofas & Couches,723.0,513.3,0,25,383
Unbeatablesale TCcheck8x108-Pk10-RedK98 Gingham Checkered Chair Bows - White & Red - 8 X 108 In. - Pack Of 10,Unbeatablesale,Other Party Accessories,48.25,48.25,0,30,294
20pcs/Bag 12mm Frosted Acrylic Flower Beads For DIY Jewelry Making Accessories,SHEIN,Beads,1.1,1.1,0,25,25
Synthetic Hair Buns Chignon Ponytail Hairpiece Updo Donut Hair Extensions Flexible Elastic Band Dark Brown  For Women,SHEIN,Synthetic Extensions,2.1,1.9,0,25,403
"New Flower, Plant And Butterfly Buckle Silicone Watch Band Compatible With Apple Watch, Simple & Comfortable Outdoor Sports Casual Style Strap, Compatible With Apple Watch 38/40/41/42/44/45/49, Also Compatible With Apple Watch Ultra/SE/8/7/6/5/4/3/2/1 (Unisex)",SHEIN,Watchbands,5.8,5.07,0,25,439
Synthetic Hair Topper Wig For Women Fake False With Bangs Clip In Hair Extension Topper Hairpiece,SHEIN,Synthetic Hair Bangs,5.3,3.66,0,25,404
"Marvel Superhero Candy Bags - 12 Pack, Avengers &  Themed Kraft Paper Gift Bags For Birthday Parties, Halloween, Christmas Decorations",Marvel,Gift Wrap Bags,6.0,5.1,0,17,166
"Bob Style Short Straight Synthetic Wig With Bangs, Black Color, Heat Resistant, Suitable For Women Daily Use, Role Play, Party",SHEIN,Synthetic Woven Wigs,12.3,10.7,0,25,407
"1500pcs White Paper Confetti, 15g Heart-Shaped Paper Shreds, Wedding Venue Throw Decor, Valentine's Day Decoration, Suitable For Wedding Party, Holiday, Home Dining Table Decor",SHEIN,Party Backdrops,2.3,1.96,0,25,314
Unbeatablesale K Tool International KTI-70015 1.5 In. Stiff Scraper & Putty Knife,Unbeatablesale,Putty Knives,17.74,17.74,0,30,351
Nickelodeon 1PC Paw Patrol Officially Licensed Paw Patrol Doll Blind Bag Random One 8 Pups Collectible Figures Cute 3D Image Surprise Bag Chase Rubble Marshall Skye Rocky Zuma Liberty Everest Character Blind Bag,Nickelodeon,"Statue, Maquette & Bust Action Figures",3.4,3.4,0,19,393
"TWS Wireless Headphones Headphones Earbuds - Unrivaled True Wireless Freedom Ergonomic Design For Ultimate Comfort HIFI Sound With Dolby Bass, ACC Stereo HD Calling And - Compatible With Android And IPhone, Ideal For Sports And Music Lovers!",SHEIN,Recording Headphone & In-Ear Audio Monitors,7.9,7.9,0,25,353
"Fashionable And Casual Crossbody Bag For Women, Large Capacity Handbags",SHEIN,Women Crossbody,5.5,5.2,0,25,466
"20pairs/Set Men's Short Socks, Soft & Comfortable, Ankle Length, Moisture Wicking & Anti-Odor, With Random Mix Of Numbers, Letters And Stripes Design, Suitable For Daily Life, For Gym",SHEIN,Men Ankle Socks,12.2,8.05,0,25,257
"Unbeatablesale 224 Mm Century Edge Pull, Matte Black",Unbeatablesale,Door Handles & Locks,29.04,29.04,0,30,122
"1 Set Of 20 High-Quality Nylon Bristle Paintbrushes - Multi-Purpose Art Painting Brushes, Suitable For Acrylic, Oil, Watercolor, Wall Art, Soft Drawing, And Cleaning/Maintenance Of Phones, Tablets, Keyboards, Electronic PCBs - Wooden Handles, Soft & Gentle Surface",SHEIN,Paint By Number Pens & Brushes,4.2,4.0,0,25,311
"1PC Plush Bear Crossbody Bag, Khaki Wide Shoulder Strap Cute Shoulder Bag, Very Suitable For Children, Mini Coin Purse, Mobile Phone Bag, Back-To-School Season Small Item Storage, Suitable For Boys And Girls, Very Suitable As A Back-To-School Gift, Birthday Gift",SHEIN,Kids Crossbody Bags,5.0,4.2,0,25,210
