product_name,brand,category,initial_price,final_price,rating,brand_encoded,category_encoded
"Tall Narrow Bathroom Storage Cabinet With 3 Drawers And 2 Shelves, Free Standing Kitchen Pantry Organizer With Open Compartment, Water-Resistant Finish",SHEIN,Storage Cabinets,120.99,120.99,0,25,397
"1PC Natural Yellow Rainbow Halo Raw Crystal, Aromatherapist Stone, Home Decoration, Office Decoration, Holiday Gifts.",SHEIN,Crystal Shapes & Carvings,2.1,2.1,0,25,84
1PC Sexy Lingerie Body StockingOpen Crotch Hollow Out See Through Bodystocking Without Underwear,SHEIN,Women Sexy Bodysuits,3.39,2.14,0,25,485
"Italian Genuine Leather Thick Belt For Men, Retro Solid Brass Buckle",SHEIN,Men Belts,22.8,21.3,0,25,259
Unbeatablesale Hylomar 61701 13.53 Oz Hylomar Cleaner Spray Can,Unbeatablesale,Other Commercial Cleaning Supplies,28.53,28.53,0,30,287
"1 Set Cup & Saucer, Cute Cat Pattern, High-End Coffee Cup & Saucer Set, Latte Art",SHEIN,Teacup & Saucer Sets,12.7,12.2,0,25,416
"Unbeatablesale PIX North America MXV4-410 0.5 X 41 In. Heavy-Duty Lawn & Garden Equipment Belt,; Black",Unbeatablesale,Tool Cases,16.98,16.98,0,30,422
"30pcs,40in Rocket Balloons 6 Assorted Colors Flying Magic Long Balloons With Whistling Noise Premium-Quality Latex Balloon For Parties",SHEIN,Decorative Balloons,2.2,2.1,0,25,98
"20pcs Artificial Green Plant Leaves Valentine'S Day Gift DIY Cake Decoration, Candy Box, Birthday Party Decoration, Wedding Flower Basket, Bride Holding Flowers, Home Decoration, Dining Room, Bedroom, Windowsill Decoration, Vase Ornaments, Valentine'S Day, New Year Decoration, Outdoor Garden, Start Of School Season",SHEIN,Artificial Plants,1.5,0.83,0,25,6
"10pcs Transparent Baking Boxes With Window, Dessert Box, Pastry Box,  Gift Box, Easy And Convenient, Safe For Food Contact, Can Be Mixed And Assembled Sweets, Chocolates, Perfect For Celebrations And Home Baking",SHEIN,Wrapping & Packaging,7.8,6.63,0,25,501
1PC Retro Resin Telephone Figurine Piggy Bank Vintage Coin Bank Phone Birthday Gift Coffee Shop Decor(17CM*14.5CM*16CM),SHEIN,Decorative Crafts,21.3,20.5,0,25,100
30pcs Nail Art Decorations DIY Art Punk Style Mixed Pumpkin/Spider/Bat/Witch/Vampire 3D Three-Dimensional Nail Art Decoration Accessories Jewelry,SHEIN,Rhinestones & Decorations,2.0,1.7,0,25,356
"Juvale Wooden Drawer Organizer With 12 Compartments, Divided Tray For Arts And Crafts Supplies, Stationery, Small Items, 12 Grid Sorting Tray, Dark Brown (13.2 X 9.2 X 1.5 Inches) Halloween Decorations Halloween Costumes Autumn Decor Festival Decor",SHEIN,Storage Drawers,25.7,17.99,0,25,398
Unbeatablesale K Tool International KTI22521 3/8 Inch Drive Flex Spark Plug Socket 5/8 Inch,Unbeatablesale,Sockets,13.5,13.5,0,30,381
"1PC Large Waterproof Makeup Bag With Handle - Travel Toiletry Organizer For Women And Girls - Spacious Cosmetic Storage For Essentials - Perfect Gift, Cruise Essentials Dorm Essentials,Wedding Bridesmaid Gifts,Mom Gifts,Birthday Gifts,Gifts For Friends And Teachers,Home Decor,Bathroom Livingroom Bedroom Decor,Bathroom Organizer,Jewelry Organizer,Lip Oil Organizer,Nail Polish Organizer Makeup Bag Storage Makeup Organizer Makeup Case",SHEIN,Travel Glasses Bag,12.0,11.2,0,25,427
"35pcs Mixed Acrylic Body Piercing Pearl Effect, Transparent Dual Color, Matte Tongue Rings For Women, Everyday And Festival Wear",SHEIN,Women Tongue Ring,6.1,4.55,0,25,492
Dolce & Gabbana 1.6oz The Only One For Women -  EDP Spray,Dolce & Gabbana,Perfume,98.0,66.74,0,7,323
Unbeatablesale 1467 Performer Series Accelerator Pump Assembly,Unbeatablesale,Car Replacement Parts,35.33,35.33,0,30,45
Unbeatablesale Jumbo Insulated Travel Bag,Unbeatablesale,Men Tote Bags,22.16,22.16,0,30,270
"Jepeak Jepeak Decorative Linen Throw Pillow Covers Cushion Cases, Pack Of 4 Rustic Woven Textured Pillow Covers For Sofa Bed Couch, 18x18 Inch",Jepeak,Cushion Cover,33.6,24.2,0,12,87
1-Piece Rustic Style Hard  Notebook With Simple Rose Print Design,SHEIN,Notebooks,4.8,4.8,0,25,281
"300 Color Professional Oil Colored Pencils Artist Pencils Set Soft Series Lead For Coloring Book Sketching Drawing Art Supplies Quality Soft Core Colored Leads For Adult , Professionals And Colorists | Protected And Organized In Presentation Tin Box",SHEIN,Colored Pencils,79.2,79.2,0,25,72
"PHNIBIRD Four-Leaf Clover Zirconia Necklace, Women's Necklace, Women's Pendant Necklace, Hypoallergenic Material, Silver, Embedded Zirconia Necklace, Fashionable And Simple, Daily Commute, Daily Wear, Fashion Versatile, Daily Commute, Gift For Sister, Gift For Yourself, Gift For Sister, Birthday Gift, Graduation Gift, Holiday Gift, College Style, Casual Style, Resort Style",SHEIN,Fine Pendant Necklaces,10.2,10.2,0,25,145
360Pcs Hypoallergenic DIY Earring Hooks For Jewelry Earring Making Supplies Kit Gold And Silver Fish Hook Earring Set,SHEIN,Jewelry Making Findings,18.99,15.99,0,25,203
"1pc Tree Pattern Decorative Throw Pillow Cover (Pillow Insert Not Included), Soft & Comfortable Single-Sided Printed Cushion Cover For Bedroom, Living Room, Sofa, Party Decoration",SHEIN,Cushion Cover,2.5,2.0,0,25,87
"Unbeatablesale Keeper 8874430 16 Ft. Multicolored Tie Down Strap, 3333 Lbs",Unbeatablesale,Other Tool Organizers,33.83,33.83,0,30,304
"1pc Unisex Brown PU Leather Cuff Bracelet With Circular Decor, Vintage Medieval Viking Warrior Cosplay Accessory Halloween",SHEIN,Handwear,3.9,3.32,0,25,182
"1PC Magic Small Hand With Magnet, Prank Props Dark Magic Toy, Simple Coin Magic,Horror Magic Funny Game Toy,Halloween Party Games Favors Activity Supplies",SHEIN,Party Games & Activities,1.7,1.67,0,25,316
"Unbeatablesale Jiallo 15120 Clock,; Thermometer & Hygrometer",Unbeatablesale,Wall Decoration,89.02,89.02,0,30,435
Unbeatablesale Jiallo 33016 Mirrored Jewelry Organizer 3 Compartments,Unbeatablesale,Jewelry Boxes,41.2,41.2,0,30,197
Unbeatablesale 32.25 In. W X 8.87 In. H X 1.62 In. P Architectural Accent - Legacy Center Onlay,Unbeatablesale,Wall Decoration,46.8,46.8,0,30,435
"1PC Silk Roses Vine Artificial Flowers Fake Green Leaf Plants Valentine's Day Bride Bouquet For Autumn Decorations Wedding Vase For Home Dining Room Bedroom Decorations, Festival Birthday Party Accessories, Outdoor Garden Decorations",SHEIN,Artificial Flowers,2.3,1.77,0,25,4
Unbeatablesale Suntime Boston College Eagles-Football Helmet Wall Clock,Unbeatablesale,Other Sports Accessories,48.61,48.61,0,30,300
Unbeatablesale KB CR1439 70 X 17 X 17 In. Coat Rack With Storage - Cherry,Unbeatablesale,Coat Racks,175.18,175.18,0,30,68
Unbeatablesale Syracuse Orange Spirit Series Sportula Grill Spatula,Unbeatablesale,Other Sports Accessories,29.74,29.74,0,30,300
1PC Natural Crystal XiuYu Jade Pagoda Hand Carved Figurine Engrgy Stone Quartz Freeform Phantom Tree Carving Crafts Halloween Ornament For Gifts Home Office Desktop Decoration,SHEIN,Table Decorative Ornaments,20.6,19.9,0,25,409
"Sun Protective Anti UV  1pc Summer Sunscreen Breathable Ice Silk Mask, Women Skin Friendly Comfortable Sun Protection Anti-UV Mask Ski Mask,Suitable For Cycling,Riding Motorcycle And Skiing",SHEIN,Cycling Mask & Scarf,1.8,1.37,0,25,94
"144 Pieces Pizza Party Supplies Pack Decorations, Dinnerware Set With Plates, Napkins, Cups, And Cutlery (Serves 24) , Festival, Party , For Halloween Or Christmas Party",SHEIN,Disposable Tableware Sets,38.99,23.49,0,25,119
Unbeatablesale Jacks 10239 Forged 14 In. Nail Clincher,Unbeatablesale,Horse Grooming & Bathing Supplies,38.69,38.69,0,30,190
10 Pcs Bohemian European And American Sports Headbands For Women Wide Yoga Elastic Headbands Running Headbands Sports Hair Accessories Headdresses,SHEIN,Hair Bands,7.8,7.5,0,25,173
Synthetic African Fluffy Drawstring Ponytail Hair Extensions For Women Short African Curling Clip Curly Drawstring Bun (1B ),SHEIN,Synthetic Extensions,14.2,11.01,0,25,403
10pcs Transparent Chocolate Bouquet DIY Packaging Materials Finished Flower Shop Materials Valentine's Day Supplies Chocolate Cup Tray,SHEIN,Other Party Supplies,2.8,2.8,0,25,297
"1 Set,Automatic Watering System Indoor Drip Irrigation System With 10 Heads Plant Watering Unit,Yard And Garden Watering Can For Indoor Outdoor Plants 5.25Ft",SHEIN,Watering Kits,5.7,4.85,0,25,441
"1 Set Of 2 Pieces Mop And Bucket Set With New Separation Of Clean And Dirty Water Design, Household Rotating Mop, Slouchy Mop, Hands-Free Flat Sucker Mop, Suitable For Daily Use",SHEIN,Mops and Mop Sets,74.6,74.6,0,25,273
"1PC Selenite Crystal Pumpkin Ghost Head Carving - Natural Rock Crystal Halloween Decor, Home & Office Ornamental",SHEIN,Crystal Shapes & Carvings,6.9,3.45,0,25,84
"1set-Halloween Party Hanging Swirl Decorations, Bat  Ghost Pumpkin Black Cat Cards Hanging Swirl Party Supplies,Halloween Party Decorations Set For Outdoor Indoor Decor",SHEIN,Party Backdrops,3.8,3.23,0,25,314
"20pcs Purple Disposable Napkins,Flower Shape Table Napkins For Weding Supplies, Party Favors, Hen Party Decorations Birthday And Restaurant",SHEIN,Disposable Napkins,2.6,2.5,0,25,118
"14pcs WHite Hair Beads Accessories For Braids,Star Pearl Small Bear Design Hair Rings Decorations,Women Hair Accessories For Hair And Dreadlocks. Street",SHEIN,Hair Clips,1.4,1.4,0,25,175
"30pcs/Set Minimal Solid Color French Almond Flower Style Full Cover Short False Nails With 1pc Jelly Gel & 1pc Nail File, For Women & Girls Beauty Parties, Dates, Events",SHEIN,Press On False Nails,1.8,1.6,0,25,346
1 Set Halloween Scarecrow Pumpkin Home Bedroom Living Room Decor,SHEIN,Mirror Stickers,3.4,2.72,0,25,271
Unbeatablesale Hydro Air HA104320 Gunite Venturi Tee,Unbeatablesale,Swimming Pools,24.32,24.32,0,30,402
"Jepeak Jepeak Pack Of 4 Rhombus Textured Throw Pillow Covers Cushion Cases, Burlap Linen Decorative Pillow Covers For Sofa Couch Bed Home Decor, 16x24 Inch",Jepeak,Cushion Cover,36.4,26.2,0,12,87
"New Casual Solid Color One Shoulder Bag, Street Style Simple Tote Hand Carry Crossbody Square Bag",SHEIN,Women Top Handle Bags,10.3,9.7,0,25,493
"Unbeatablesale 1.75 In. Clear Gel Floating Candles, Aqua - 12 Piece Per Box",Unbeatablesale,Candles,16.8,16.8,0,30,41
"22LB Life Size Sex Doll Torso, Lifelike Female Sex Doll For Men With Soft Big Boobs Big Butt Pussy Ass, Realistic Sex Dolls Full Size Love Dolls Male Masturbator For Vaginal Anal Breast Sex",SHEIN,Sex Dolls,153.0,95.7,0,25,369
Casual Solid Color Shoulder Bag New Style Handbag Fashion Simple Crossbody Square Bag,SHEIN,Women Top Handle Bags,11.3,10.6,0,25,493
"Unbeatablesale Jgoodin P50180R-V01 Myra Necklace 10 CT Rhodium Necklace, Multi Color",Unbeatablesale,Women Layered Necklaces,23.46,23.46,0,30,477
New Casual Solid Color Shoulder Bag Street Fashion Simple Trendy Crossbody Square Handbag,SHEIN,Women Top Handle Bags,11.7,7.61,0,25,493
30pcs  Ear Plasters Waterproof Correction Ear Surface Ear Flash Ear Face Small Invisible Breathable Skin Friendly Fixed Patch Self Adhesive Patch For Delicate Face,SHEIN,Tool Accessories,2.4,2.1,0,25,421
10pcs Red Satin Chair Sashes Bows Silk Chair Ribbon Ties For Wedding Banquet Party Hotel Event Decorations,SHEIN,Sashes,11.9,10.93,0,25,362
"PHNIBIRD Rectangular Hoop Earrings, Hypoallergenic Material, Minimalist Style, Unisex Design, Fashion Accessory For Daily Wear, Suitable As Birthday, Holiday, Graduation Gifts For Girlfriend, Boyfriend, Friend, Family",SHEIN,Fine Hoop Earrings,9.5,9.5,0,25,144
Unbeatablesale Keeney SD8BRASSNC Shower Drain For 2 In. Sch 40. ABS &Amp; PVC Pipe,Unbeatablesale,Showerheads & Accessories,36.24,36.24,0,30,374
Unbeatablesale Intrend Tile LS014-D Granite Basketweave Pattern Mosaic Blend,Unbeatablesale,Swimming Pools,23.93,23.93,0,30,402
"New Arrival Street Style Casual Solid Color Shoulder Bag, Handbag, Crossbody Bag, Fashionable And Minimalist Small Square Bag",SHEIN,Women Top Handle Bags,11.4,8.55,0,25,493
10pcs Reusable Transparent PET Index Labels - Office Supplies,SHEIN,Sticky Notes,1.5,1.5,0,25,395
"20pairs/Pack Mixed Style Transparent Eyelashes, 8D Fluffy Mink Cat Eye Effect, Transparent Band For More Comfortable And Natural Wear, Extending And Enhancing Outer Eye Corner Beauty Tool, Lightweight And Comfortable, Suitable For Daily Occasions, Work, Holidays And More",SHEIN,False Eyelashes,5.5,4.8,0,25,139
"Unbeatablesale Jacks 10186-PU Cotton Lead Rope, Purple",Unbeatablesale,Horse Grooming & Bathing Supplies,31.1,31.1,0,30,190
"1PC Rocket Shaped Pool Floats For Kids With Water Pistol,Summer Infant Pool Float Beach Toys In Water,Baby Swimming Ring Toddler Floaties With Handle",SHEIN,Children Water Sports,16.0,14.1,0,25,59
"31 Pieces, 10 Inch White Heart-Shaped Latex Balloons With Ribbons, Valentine's Day Decoration, Birthday Decoration, Wedding Decoration, Anniversary Decoration, Theme Event Decoration, Engagement Decoration, Home Decoration, Party Decoration Supplies",SHEIN,Decorative Balloons,2.7,2.3,0,25,98
"New Warm Flip-Cover Thick Fingerless Knitted Gloves, Faux Cashmere, For Winter, Factory",SHEIN,Men Other Gloves,3.6,3.4,0,25,266
"1 Set Sewing Microneedle With 50 Bear Clips And 660 Adhesive Pin Quick Clothing Retentors, Mini Sewing Machine For Quick Attachment Of Clothing Buttons, Handheld Sewing Machine Instant Button Clothing Connector, Durable And Comfortable Clip Kit For Clothing, Quilts, Sheets, Etc",SHEIN,Tag Guns,5.0,4.8,0,25,412
"2024New 18inch Doll Clothes,Fit 38-45 Cm Newborn Dolls And Baby Dolls (Dolls Not Included)",SHEIN,Kids Doll Clothing,5.4,4.84,0,25,212
"Insulated Door Curtain,31.5x83in Winter Doorway Cover Screen, Soundproof Blanket, Privacy Curtains, Noise Reduction Door Cover, Noise Barrier Blanket For Patio Kitchen Bedroom (31.5x83in-Gray)",SHEIN,Japanese Curtains,135.0,67.5,0,25,195
"Unbeatablesale 22 In. W X 22 In. H Round Gable Vent Louver, Decorative",Unbeatablesale,Wall Decoration,73.54,73.54,0,30,435
"Plaid Pattern Shoulder Tote Bag With Bag Charm Handbags for Women, Shoulder Bags Purse Top Handle Hobo Handbag, Large Capacity Purse Satchel Fashionable Tote Bag School Gift, Retro Crossbody Purse Travel Back packs",SHEIN,Women Tote Bags,10.7,8.03,0,25,494
"31.4in Gold Garment Rack Metal Wardrobe Rack With Wheels Closet Hanger Rack For Coats, Shirts, Dress Halloween Decorations Halloween Costumes Autumn Decor Festival Decor",SHEIN,Standard Hanger,59.99,45.6,0,25,388
"30Pcs/Box Boxed Stickers, Hibiscus Flower Blooming Series, Exquisite Artistic Flower Petal Theme Stickers, Scrapbook Supplies, Decorative Notebooks, Photo Frames, Phone Cases, Water Cups, Garbage Magazines, Stationery Boxes, DIY Personalized Collage",SHEIN,Assorted Stickers,1.6,1.6,0,25,9
"1pc Unique & Charming Daisy Flower Shaped Open Ring, Fashion Jewelry Gift For Women - Party, Birthday, Anniversary",SHEIN,Fine Single Ring,8.1,8.1,0,25,146
"14pcs Set: Creative Triangle Wood Pencils, HB Macaron Colors Pencils, Ergonomic Pencils (Unsharpened)",SHEIN,Standard Pencils,3.0,1.8,0,25,389
"Unbeatablesale Kdar N8HD100 7.9 In. Heavy Duty Standard Cable Ties, Natural - Pack Of 100",Unbeatablesale,Labeling Supplies,19.13,19.13,0,30,239
"1pc Unisex Children & Adults Rhinestone Studded Belt, Punk Fashion Rivet Leather Belt For Jeans, Jackets, Millennium Punk, Hip Hop, Cosplay, Halloween",SHEIN,Kids Belts & Suspenders,3.6,3.1,0,25,208
Unbeatablesale T Black Halter - 800-1100 Lbs - Medium,Unbeatablesale,"Pet Collars, Leashes & Harnesses Sets",48.12,48.12,0,30,325
"1set Butterfly Girl Digit Oil Painting Kit, Art Painting Set For Bedroom Decor And Wall Art, Simple And Fun Painting Hobby, Best Gift For Friend, 40*50CM",SHEIN,Paint By Number & Accessories,6.4,6.2,0,25,310
Swimming Pool Cover Protector Dustproof Waterproof Paddling Pool Cover 10,SHEIN,Other (Swim Gear),59.99,30.99,0,25,286
Asics Women's Gel Kayano 30 Running Shoes In Blue Denim,Asics,Women's Running Shoes,162.75,162.75,0,1,497
Kapuluan Coconut Oil Jar 2oz And Coconut Pulling Oil Tropical Breeze Flavor 8oz,SHEIN,Mouthwash,27.0,24.99,0,25,274
20pcs Flower Design Hair Claw Boho,SHEIN,Hair Claws,1.6,1.6,0,25,174
Syncfun 28 Pcs Valentine 28 Mochi Squishy Filled Heart Toys And Cards,SHEIN,Fidget Toys for Teenager,24.8,18.8,0,25,142
20pcs Cute Cartoon Pink Hair Clip For Women,SHEIN,Hair Clips,3.8,3.6,0,25,175
20pcs Random Color Hair Claw Boho,SHEIN,Hair Claws,1.4,1.4,0,25,174
20pcs Cute Cartoon Pink Hair Clips For Women,SHEIN,Hair Clips,3.2,2.56,0,25,175
20PCS Women's 3 Color Box Y2k Dopamine Color Pentagon Star Small Hairpin Bb Clip,SHEIN,Hair Clips,2.3,1.38,0,25,175
"1pc Travel Portable Door Lock, Reliable Safety For Travel And Hotel Stays, Provides Extra Privacy And Security Against Unauthorized Entry For Homes, Hotels, And Apartments Travel Essentials School Back To School School Supplies Holiday Camping Holiday Essentials Vacation Accessories Mini Summer",SHEIN,Cipher Locks,4.0,3.8,0,25,62
"Unbeatablesale 36 In. Spiral Eucalyptus Vine Artificial Flower Leaf,; Burgundy",Unbeatablesale,Artificial Grass,24.5,24.5,0,30,5
"1PC Silk Roses Vine Artificial Flowers Fake Green Leaf Plants Valentine's Day Bride Bouquet For Autumn Decorations Wedding Vase For Home Dining Room Bedroom Decorations, Festival Birthday Party Accessories, Outdoor Garden Decorations",SHEIN,Artificial Flowers,2.7,2.6,0,25,4
Fossil Women's Harlow Linear Texture Gold-Tone Stainless Steel Chain Necklace,Fossil,Women Pendant Necklaces,54.25,54.25,0,8,480
Judy Blue HIGH WAIST STRAIGHT LEG JEAN,SHEIN,Women Jeans,78.0,55.0,0,25,475
"1pc Unisex Fashionable Wraparound Sports Sunglasses, Suitable For Hiking, Running, Outdoor, Travel",SHEIN,Women Sports Glasses,4.4,4.2,0,25,488
"Summer Orange Juice Drink Scented Candle - Candle Gift Set, Smokeless Candle, Healthy & , Orange Juice Fragrance Candle To Bring Vitality & Freshness To Your Space",SHEIN,Jar Candles,9.0,8.7,0,25,196
10pcs Student Cartoon Pencil Writing Wooden Pencil With Rubber Head Exam Learning Prize (Random Style),SHEIN,Kids Writing Tools,2.3,2.3,0,25,231
"1PC-PANCERKA- Electric Kettle For Coffee & Tea - 1.8L Water Boiler 1000-1500W, Borosilicate Glass, Easy Clean Wide Opening, Auto Shut-Off, Cool Touch Handle, LED Light. 360° Rotation, Boil Dry Protection",SHEIN,Electric Kettles,37.8,18.9,0,25,131
"JENNIFER 24 Inches Of Natural Layered Long Curly Hair With Fringe Wig, Specially Designed For Girls A Beautiful Wig, Suitable For Women Festival Cosplay Friends Party Daily Wear",SHEIN,Synthetic Woven Wigs,14.6,12.7,0,25,407
"20pcs Furniture Chair Leg Protectors, Silicone Chair Leg Covers, Anti-Slip Chair Leg Pads",SHEIN,Edge Protection,2.2,2.1,0,25,130
New Student Pencil Case Ins Large Capacity Simple Front Window Pencil Case Girl Cosmetic Bag Storage Bag Pencil Case,SHEIN,Pencil Bags,4.3,2.15,0,25,318
Paris Hilton Just Me For Men 3.4 Oz EDT Spray,Paris Hilton,Perfume,48.66,37.69,0,21,323
"Jepeak Jepeak Decorative Throw Pillow Covers Pack Of 4 Chenille Pillowcases Cozy Modern Concise Square Cushion Covers For Sofa Couch Bedroom Home Decor, 24x24 Inch",Jepeak,Cushion Cover,42.0,30.2,0,12,87
Instantly Upgrade Your Look With 24pcs Short Square Black White French Style Asymmetrical Stripe Graffiti Elegant Floral Solid Color Glitter 3D Star Bling Pearl Heart Rhinestone Decor Full Cover Fake Press On Nail Kit Suitable For Daily Will Give Your Look A Hot,SHEIN,Press On False Nails,2.1,1.8,0,25,346
"20Pcs Pretty Girl Series DIY Charms For Shoe Key Chain Sandals Beach Bags, PVC Shoe Charms For Clogs Premium Quality Popular Decorations Accessories Great Gifts For Christmas, Birthday, Party",SHEIN,Fittings DIY & Tools,2.2,2.1,0,25,149
"14pcs Pink Hair Beads Accessories For Braids,Star Pearl Small Bear Design Hair Rings Decorations,Women Hair Accessories For Hair And Dreadlocks. Cute",SHEIN,Hair Clips,1.5,1.4,0,25,175
"ROMWE Fairycore 10pcs Fall Star & Moon Hand-Painted False Nails + 3pcs Double-Sided Adhesive, Removable Manicure Stickers, High Gloss Colorful Nail Art, Fit For Holiday Party, Dance & Daily Wear",ROMWE,Press On False Nails,7.2,6.3,0,22,346
Unbeatablesale Super Talent FNX512MORM NGFF DX3 512GB M.2 SATA3 Solid State Drive,Unbeatablesale,Computer & Office Accessories,48.79,48.79,0,30,74
30.7inches Outdoor Water Fountain - 6-Tiers Rock Waterfall Fountain With Led Lights For Home Garden Decor,SHEIN,Floor-Standing Fountains,235.6,170.4,0,25,153
30pcs-2024 Graduation Cap Gift Box Graduation Party Favors Box Candy Treat Box With Gold Tassel - Class Of 2024 Congrats Grad Centerpieces For Table Graduation Party Decorations 2024 - Black Gold,SHEIN,Gift Wrap Boxes,7.3,7.1,0,25,167
Unbeatablesale 2066-11x14-GC 11 X 14 In. Sidewalk Cafe Poster Print By Van Gogh,Unbeatablesale,Posters & Prints,10.67,10.67,0,30,344
Infant Anti-Fall Pillow Head Protector Toddler Walking Safety Pad,SHEIN,Baby Safety Harnesses & Leashes,17.4,11.31,0,25,12
Tape In Hair Extensions Synthetic Hair 24 Inches 10pcs 55g/Pack Straight Hair Superior Quality Synthetic Extensions,SHEIN,Synthetic Extensions,7.0,3.5,0,25,403
"Casual Solid Color Shoulder Bag, New Fashionable Minimalist Crossbody Handbag",SHEIN,Women Top Handle Bags,10.5,6.83,0,25,493
Marc Jacobs Women's Handbag WHITE H009L01SP21140-2,Marc Jacobs,Women Top Handle Bags,504.16,381.5,0,15,493
"JAKEHOE Multi-Purpose Fabric Stain Remover, Gentle Cleaning For Stubborn Grease And Dirt",SHEIN,"Clothes, Carpets and Leather Cleaners, Bleaches & Softeners",3.5,3.4,0,25,66
"1pc/3pcs 10mm Cute Flower Silicone Straw Caps, Reusable Straw Dust Plugs For 30oz & 40oz Tumblers, Valentine's Day Gift School Supplies,Back To School",SHEIN,Straw,1.9,1.8,0,25,399
Unbeatablesale 15-1900-2424-608 PVC Board 24 X 24 In. - Dark Blue - 1 Piece,Unbeatablesale,Whiteboard,26.69,26.69,0,30,445
"1pc Unique Design Gray Cubic Zirconia, White Jade Flower, Pearl & Tassel Decor Drop Earrings For Women Daily Wear",SHEIN,Women Dangle Earrings,14.7,14.7,0,25,467
Unbeatablesale Summer Games Large,Unbeatablesale,Bird Toys,20.93,20.93,0,30,31
"12pcs/Set Red ""I Love You"" Letter Balloons Set, Includes Romantic Red Heart Balloons, 16 Inch ""I Love You"" Foil Letter Balloons, For Valentine's Day, Proposal, Wedding Party Decor, Home Decor, Bridal Shower, Special Romantic Night, Anniversary, Birthday Party Decoration",SHEIN,Decorative Balloons,2.8,2.7,0,25,98
"1pc Unisex Square Color Changing Polarized Sunglasses, UV Protection For Driving, Fishing",SHEIN,Sports Glasses,3.6,2.74,0,25,386
Unbeatablesale TDI Brands 31-2052 Dewit Dutch Transplant Spade,Unbeatablesale,Gardening Tools,158.02,158.02,0,30,162
"Juli Kids Ski Goggles,Interchangeable Double Layer Spherical Lens,OTG Anti-Fog Snowboard Skate Snow Goggles Age 4-16 4300",SHEIN,Kids Sports Goggles,39.99,29.99,0,25,225
1pc Tulle Bow Headpiece Minimalist Wedding Veil Hair Accessory Witch,SHEIN,Bridal Veils,5.1,4.9,0,25,34
Jewellery Pop Beads Kid Toy  Gift 248 Pieces DIY Fashion Beads Set For Necklace Bracelet Art Crafts Motor Skill Training Toy For Girls 3+,SHEIN,Kids Abacuses,14.4,14.4,0,25,207
20ft * 8ft Light Pink Sheer Chiffon Backdrop Curtain For Parties 4 Panels 5*8ft Wrinkle Free Slight Glimmer Backdrop Drapes For Birthday Wedding Photo Photography Backgrounds,SHEIN,Party Backdrops,65.8,45.16,0,25,314
20pcs Solid Hair Claw,SHEIN,Hair Claws,1.4,1.18,0,25,174
"1 Set Of Socket Wrenches, Multifunctional Manual Tool Kit For Driving, Chrome Vanadium Steel, Professional Mechanical Car Motorcycle Bicycle Repair Tool, Durable Metal Shell 46-Piece Professional Socket Set - Durable 1/4 Inch Drive Ratchet Wrench Kit With Metric Sockets For Automotive Repair, Household Tasks, And DIY Projects - Includes Storage Case And Heavy-Duty Metal Construction",SHEIN,Hand Tool Sets,19.8,19.8,0,25,180
"1pc Unframed Glittery High-Glossy Fabric Rectangle Contemporary Canvas Poster - Reusable, Pre-Pasted, Multi-Surface Installation - Universe Spaceship UFO Painting, Starry Night Sky Artwork For Bedroom, Office, Living Room, Wall Decor, Home And Dormitory Decoration",SHEIN,Decorative Painting & Calligraphy,5.0,2.5,0,25,105
Women's Fashionable Versatile Retro-Style Pendant Multilayer Necklace,SHEIN,Women Layered Necklaces,1.6,1.6,0,25,477
Unbeatablesale KB WR1345 48 X 32 X 12 In. Wine Rack - Black,Unbeatablesale,Bars & Wine Cabinets,227.62,227.62,0,30,19
"1 Set Vintage Palace-Style British Floral Coffee Cup & Saucer Set, High-End Ceramic Coffee Cup & Saucer, French Afternoon Tea Dessert Cup & Saucer, Exquisite Gift Cup",SHEIN,Mugs,15.6,15.1,0,25,275
"DAZY 1PC Pink Color Solid Wide Headband, Classy Look, Elegent, For Casual And Daily Use",DAZY,Headbands,1.7,0.97,0,5,185
32 Large Wooden Floral Shapes - Craft Wood Decorations & Embellishments,SHEIN,Wooden Diy Base & Board,4.7,4.5,0,25,500
"Jepeak Jepeak Pack Of 4 Rhombus Textured Throw Pillow Covers Cushion Cases, Burlap Linen Decorative Pillow Covers For Sofa Couch Bed Home Decor, 20x20 Inch",Jepeak,Cushion Cover,36.4,26.2,0,12,87
"1PC Silk Roses Vine Artificial Flowers Fake Green Leaf Plants Valentine's Day Bride Bouquet For Autumn Decorations Wedding Vase For Home Dining Room Bedroom Decorations, Festival Birthday Party Accessories, Outdoor Garden Decorations",SHEIN,Artificial Flowers,2.4,1.85,0,25,4
"Unbeatablesale Tape Logic T933220012PK 0.50 In. X 60 Yards 2200 Masking Tape, Natural - Pack Of 12",Unbeatablesale,Masking Tape,37.83,37.83,0,30,255
"1 Piece S925 Sterling Silver DIY Bead For Daily Matching, Give To Girlfriend Or Best Friend",SHEIN,Fine Beads,10.6,9.45,0,25,143
Women's Glitter Strappy Wrapped Wedge Heel Platform Sandals,SHEIN,Women Platforms & Wedge Sandals,39.95,39.95,0,25,481
"1 Roll 2cm X 5m Super Strong Waterproof Double Sided Tape: Heavy-Duty Adhesive For Wall Decor & Appliances, Essential For Home DIY Projects",SHEIN,Double Sided Tape,2.7,2.7,0,25,124
"10pcs Unique Halloween Skull-Shaped Candy Packaging Bags - Laser-Cut, Cross-Border Special, Yin Yang Ziplock Design, Ghost Festival Party Favors, Spooky Gift Idea",SHEIN,Wrapping & Packaging,1.7,1.6,0,25,501
Internet Celebrity PU Iridescent Laser Makeup Bag Ins Single Letter Embroidery Wash Bag Travel Portable Pillow Shaped Storage Bag,SHEIN,Makeup Bags,4.2,3.7,0,25,251
